,Title,Author,ID,Score,Total Comments,Post URL,Post Text
422,Everyone I know is complaining about the high meat prices right now and I'm all like *haaaave you met beans?*,Afireonthesnow,r6ml40,1201,116,https://www.reddit.com/r/vegetarian/comments/r6ml40/everyone_i_know_is_complaining_about_the_high/,"Just hard to sympathize with people going ""oh myyyy the king crab prices are $90 a pound and chicken is $5 a pound what is the world COMING to?!?!* 

Like maybe this is what meat should cost?  Maybe we should stop subsiding the destruction of our planet so you can eat meat every meal.  Like idk if meat prices doubled, maybe you could try eating half the meat you used to?  I'm fine with people eating some meat but I think these new prices are a good thing.  It should be a more luxury item, not something you eat every meal.

I went home for Thanksgiving and I'm flexitarian so I do eat meat *occasionally* but I keep telling my parents I really prefer veggie and am happy to cook.  They still keep telling me about all these meat stories and offering me ham and turkey and pork sausage and I'm like pls stop?  I don't want to eat this ham that apparently cost way more than normal.  🙄"
423,My take on Peking Duck Pancakes... just vego!,Crottison,ky91dk,1197,56,https://v.redd.it/ok60g86fllb61,
424,[Homemade] Baked Buffalo Tofu Wings,Swagsman21,d4oeq1,1202,42,https://i.redd.it/vo7oi9i3xsm31.jpg,
425,Good time to be vegetarian,awahay,ebpjmz,1199,137,https://i.redd.it/req91x83w3541.jpg,
426,WHYYYYYYYYYYY,,jga85x,1195,95,https://i.imgur.com/fxqTeLt.jpg,
427,"China going vegan? Massive decline in meat consumption, vegetarian restaurants double in 5 years in Shanghai",lnfinity,8hne91,1194,39,https://www.financialexpress.com/world-news/china-going-vegan-massive-decline-in-meat-consumption-vegetarian-restaurants-double-in-5-years-in-shanghai/1079511/,
428,Omnivores be like,n3hes,t6mair,1187,102,https://i.redd.it/kg3rgc764el81.png,
429,Burger King to launch meatless burgers across Europe — Burger King is launching a vegetarian burger in more than 20 markets across Europe,BlankVerse,dxqnz0,1185,109,https://www.cnbc.com/amp/2019/11/11/burger-king-to-expand-meatless-burgers-in-europe-and-us.html,
430,Homemade Veggie Quiche I made a week ago. My mom and I finished the whole thing in two days.,bellastella0820,kcqmce,1188,27,https://i.redd.it/ta7flni9z2561.jpg,
431,"America’s First Meat-Free Fast-Food Restaurant Is Getting Ready To Expand - Launched two years ago in a small town in Northern California, Amy’s Drive Thru has been a runaway success–much to the surprise of the owners, who now hope to take it nationwide",skulloflugosi,6xmns1,1187,56,https://www.fastcompany.com/40460920/americas-first-meat-free-fast-food-restaurant-is-getting-ready-to-expand,
432,Me going out for dinner after serving restaurant quality food at home for years:,andi00pers,y6ksq0,1191,76,https://i.redd.it/a5yzspg68fu91.jpg,
433,Seitan Tofu Cutlets,pocketmole,xlyou6,1184,44,https://i.redd.it/ggcwrbq79mp91.jpg,"
Recipe: https://myquietkitchen.com/vegan-wings/comment-page-1/?unapproved=16320&moderation-hash=ee8fa0e5236be98dfc3813583d566b7f#comment-16320"
434,Vege Map! Per-capita map of the vegetarian/vegan restaurants across the USA,Friend_of_the_trees,in2pq7,1184,157,https://i.redd.it/brkm19iv5cl51.png,
435,"I found this menu from 'The Alpha , ' one of the firsf vegetarian restaurants in London which opened in 1879. Does anything look tempting ?",sparksqueen,cx6orb,1182,215,https://i.redd.it/tkt6hehcagj31.jpg,
436,I made vegetarian chili cheese fries as a treat today,thethingsIam,iquv93,1182,53,https://i.redd.it/a402bx21yjm51.jpg,
437,"Splurged on Beyond Sausage. Cooked with potatoes, red onions, peppers and mushrooms.",Unpopular_couscous,epaq32,1181,80,https://i.redd.it/nzt2p10x41b41.jpg,
438,Lebanese restaurants are the best,Haelx,9nu5rh,1178,55,https://i.redd.it/p76zlk38ryr11.jpg,
439,My first vegetarian Thanksgiving. (Almost vegan except for butter),nobodysaynothing,e366qs,1178,52,https://imgur.com/XmSKp8U,
440,Fake meats will potentially destroy diversity of vegetarian burgers,,jz5wm8,1180,232,https://www.reddit.com/r/vegetarian/comments/jz5wm8/fake_meats_will_potentially_destroy_diversity_of/,"I've noticed a lot of burger places around me are adding  fake meats from either beyond or impossible. At first this was great, but then one of those places, A&W, got rid of their old vegetarian burger, which was rather unique in its taste. Now even casual dining places are moving towards the same patties. Feels like a lot the old unique vegetarian options are all on the way out"
441,Last Thanksgiving was the last time I ate meat. This year’s meat free meal!,cinnamon_or_gtfo,7f7xs0,1173,53,https://i.redd.it/0v803js0txzz.jpg,
442,Black Bean Brown Rice Burritos with homemade salsa,Plant_Based_Pithrin,dopha0,1176,23,https://i.redd.it/xwi22769ahv31.jpg,
443,My mother is... supportive? (All in good humour!),Sabrielle24,ajcp1d,1173,42,https://i.redd.it/0p4018yundc21.jpg,
444,👍🏻,ghostdangers,6l6hc4,1175,12,https://i.redd.it/m96izrer7k7z.jpg,
445,IT...BEGINS.... Happy Halloween everyone!,Sixtyhurts,jlk24x,1176,24,https://www.reddit.com/gallery/jlk24x,
446,panda express beyond orange chicken is 10/10,lady_k80,qspeyc,1173,61,https://i.redd.it/k3tnymjbg9z71.jpg,
447,"Costco Impossible, now in two pack price",ElectronGuru,n9829s,1176,85,https://i.imgur.com/3APaCJn.jpg,
448,Vegetarian “beef” stroganoff using Beyond ground beef,basicstrips_,cob53e,1174,56,https://i.redd.it/uwutpfolpif31.jpg,
449,"Veggie turkey, pepper jack, cucumber, carrots, balsamic-marinated red onion and baby spinach on Dave’s killer bread with homemade green goddess dressing",enjoyyouryak,lz2c1n,1172,36,https://i.redd.it/6dx6aykf1fl61.jpg,
450,I made JD and Black Bean burgers and 4-cheese Mac.,davevw9898,at9vze,1170,33,https://i.redd.it/hascu3bf70i21.jpg,
451,Everything on this plate is homemade!,lagermelon,8jhjjw,1178,61,https://imgur.com/STuE8Yf,
452,"Harvard Prof. of Nutrition and Epidemiology Says a Plant-Based, though not necessarily vegetarian or vegan, diet could support up to 10 Billion people. A red meat heavy Western diet cannot – in spite of what the USDA says.",,f7klrb,1169,42,https://www.harvardmagazine.com/2020/03/feature-healthy-plate-planet,
453,Which one are you? I am top right. Dating a vegetarian dude currently.,Serious-Tomato404,xvf4ks,1162,242,https://i.imgur.com/blmg96r.jpg,
454,The beans understand me,,skg3bm,1169,31,https://i.redd.it/k6pbimf95uf81.jpg,
455,Shoutout to Amy's frozen meals - delicious and cruelty free,literallycantaloupe,ezzy2w,1163,109,https://i.redd.it/tg8lt9xoldf41.jpg,
456,Vegetarianism by States in India,tannu28,rrpytx,1167,101,https://i.imgur.com/J1op4UY.jpg,
457,Meow_irl,where_is_my_monkey,er871w,1162,82,https://i.redd.it/ahandwz35vb41.jpg,
458,"Pasta night, creamy caramelized onion edition",kittenparachutepants,l2ch9h,1163,37,https://i.redd.it/opn7yfp5asc61.jpg,
459,[I made] Pad Thai with crispy peanut tofu! Seriously one of the best things I've made. Crazy delicious. (Recipe in comments!),Chopinplease,de79iv,1165,39,https://i.redd.it/lfos6j2lsyq31.jpg,
460,"I’ve been wanting to make ratatouille for years, and my first attempt was delicious!",SilverCarbrera,i3xnbg,1164,44,https://i.redd.it/5kbgfe2ro3f51.jpg,
461,Vegetarian Seitan Wings!,thecrazydumpling,gcaxqb,1162,35,https://i.redd.it/vqi17jun6ew41.jpg,
462,The Avocado Gods have smiled upon me. Tiny seed. Lots o’ avo.,Flareola,bke2e6,1162,40,https://i.redd.it/1okldsrhj2w21.jpg,
463,Need my almond milk,DrBocker,foyz7l,1162,136,https://i.redd.it/ss9k2ep93wo41.jpg,
464,As a vegan I'd just like to say...,TarAldarion,dbq4q6,1163,67,https://www.reddit.com/r/vegetarian/comments/dbq4q6/as_a_vegan_id_just_like_to_say/,Happy World Vegetarian Day! Thanks for everything you do. 🌍❤️🎉
465,"White Castle, please never stop making Impossible sliders!",marisoul13,a9zsux,1162,93,https://i.redd.it/4cyrpdyx2u621.jpg,
466,BBQ place near me worked with Beyond Meat to develop plant-based burnt ends. They’re amazing.,cagetheblackbird,j0ftrt,1161,36,https://www.reddit.com/gallery/j0ftrt,
467,"Jokes aside I could eat eggplant everyday, so versatile",Spino8,12u1q2v,1161,156,https://i.redd.it/hrdeuns96ava1.jpg,
468,Butter chicken (of the woods mushroom!) with homemade naan. Info in comments!,herping_derp,10crp5u,1158,28,https://i.redd.it/qdhjm92upaca1.jpg,
469,Pulled Pork BBQ sandwich but made entirely from king oyster mushrooms!,SymphonyOfInsanity,npedwf,1163,79,https://i.redd.it/hjadsxc72j271.jpg,
470,BBQ Jackfruit Bao,GingersaurusRex,lj49ud,1160,34,https://i.redd.it/2atipglwz9h61.jpg,
471,"Celebrating my first 365 Days without Meat with this delicious glazed Tofu Bowl. It is so easy to abstain from meat, everboby should try it once. Greetings from Germany;)",Boozehead77,boliel,1155,58,https://i.redd.it/0uwk2kdsj7y21.jpg,
472,"After a lacklustre experience with our families, we came home and whipped together a veggie Christmas dinner to write home about.",gingerbreadspicetea,eg1x7j,1158,30,https://i.redd.it/63nseqhsy1741.jpg,
473,Carne Asada Crunch Wraps..just missing the Baja blast!,2TieDyeFor,g79xt9,1156,42,https://i.redd.it/o5c512pi6su41.jpg,
474,Bacon really does make people very sensitive...,teaandshamrocks,bjwm4m,1152,163,https://i.redd.it/b971dpe0mtv21.jpg,
475,Here I have compiled some famous vegetarians and their reasons and what they have to say about it. Please add your “Why” in the comments and any other compelling quotes you may have.,Harpzy17,yn1vz7,1148,185,https://www.reddit.com/gallery/yn1vz7,
476,"Had to make this after I read the box, guess it’s my fault for thinking a childhood fav would be safe to eat lol",charminglycomfy,j05wyo,1151,182,https://i.redd.it/fq5jcxqfthp51.jpg,
477,My shitty OC meme,patheticpotential,cfo9z4,1154,60,https://i.redd.it/d3krnnqfshb31.jpg,
478,Why am I not surprised,mulligrubs,k8ez69,1147,82,https://i.imgur.com/7wTkaAy.jpg,
479,Screw Nestlé,Cabernet2H2O,oun6bs,1150,88,https://www.reddit.com/r/vegetarian/comments/oun6bs/screw_nestlé/,"A local grocery store here (rural Norway) used to  carry a rather good selection of veg* stuff like chunks, nuggets, burgers and sausages. All from various ""semi-local"" sources and all very good.

Cue Nestlé: ""If you don't throw those products out and start exclusively selling our crap instead we will take *all* of our products out of your store!""

Nestlé are really a cynical and shitty company and they know it. And they don't care... I hate them with a passion. And if they think I now happily will start buying their shit instead they're wrong! And I hope others will follow suit. But the worst part: even if no one buys these products they won't even care."
480,"Plant-based fast food! So excited to see more places like this pop up (Plant Power Fast Food in Orange County, CA)",darkchocolatelab,mtev6f,1145,64,https://i.redd.it/eatgayub9yt61.jpg,
481,"Why the fuck are people unable to comprehend the idea that a man can be vegeterian without being ""vegeterianized"" by a woman?? And why is it seen as a negative, but not when a woman is a vegeterian???",GaiPod,krsf0j,1141,246,https://www.reddit.com/r/vegetarian/comments/krsf0j/why_the_fuck_are_people_unable_to_comprehend_the/,"I've only been vegeterian for a couple of months, and up until now it seems like 90% of the people that find out I'm vegeterian are either disappointed or annoyed. Literally the only positive feedback I've gotten was from other vegeterians, everyone else has been either neutral or negative.

Recently a male friend of mine casually asked ""how long has it been since [my vegeterian female friend] 'vegetarianized' you""? (Rough translation from Hebrew). He automatically just assumed it was because of her, and of course she had nothing to do with my change of diet.

Like, am I not allowed to have my own moral compass, empathy and ideology? Is being trying to be a good person reserved to women, and when a man does it you roll your eyes at him, or just assume he has some hidden motive? 

And to top it all off, being a vegeterian is something I try not to let people know about if I don't need to, and still whenever people find out they seem to think I'm looking for attention and positive affermations, and assume I'm gonna start preaching to them, even after I immediately say ""don't worry, I'm not gonna start preaching"".

I'm just so disappointed by my friends, and everyone that surrounds me that happens to find out I'm a vegeterian."
482,I know they've been done to death but here are my cauliflower bites 2 ways. Buffalo and Korean BBQ.,Frankburgerismydog,l85hlm,1144,42,https://i.redd.it/nz56cf1kfce61.jpg,
483,Homemade Focaccia and Soup,Unorthodox_lady,zlgcva,1136,29,https://i.redd.it/v5dwpyf93s5a1.jpg,
484,Who needs KFC when you have the best local vegan fried chicken? Highly recommend Herbie Butcher if you find yourself in Minneapolis.,Madimadi1,s8oyly,1137,99,https://i.redd.it/35befrb6uvc81.jpg,
485,"New grocery store discovery today, I’m excited",yourgirlalex,jl853u,1140,45,https://i.redd.it/fdqptsialbw51.jpg,
486,Anyone else lowkey hoping to rescue a pig someday?,,awqo0t,1136,47,https://v.redd.it/jykk90328rj21,
487,Black bean and lentil tacos on homemade corn tortillas,,ekop3k,1139,30,https://i.redd.it/6lzb13jr03941.jpg,
488,My dad has been very supportive of my decision to go vegetarian and cooked our first Beyond Burgers tonight!,big-dane,8kw939,1135,53,https://i.redd.it/w0emje7kb3z01.jpg,
489,When you're vegetarian but the rest of the family want to go to a rib house. Nothing vegetarian on the menu here except some garlic bread only. (I ate somewhere else first...) so just the booze for me.,60svintage,hkeizx,1134,180,https://i.redd.it/n8f2rjt3dl851.jpg,
490,I've been a vegetarian for 16 years...,TattooMouse,lo3oq9,1131,206,https://imgur.com/4xb22XI,
491,"Same products with the exact same price (2,69 euro), except with meat is 1kg, while the vegetarian lasagna is 400g. Even when the production of meat requires more effort. Because, you know, f*ck the vegetarian community and ecologic impact we have on society – Lidl.",OverlordGlaucus,k3ugbd,1131,98,https://i.redd.it/09jf8nom8d261.jpg,
492,A comfort indian lunch plate!,earnestpotter,gn9guv,1134,33,https://i.redd.it/4omie4fxkwz41.jpg,
493,"'Bleeding' vegan burger is an 'existential threat' to beef industry, warns New Zealand MP - The vegan product requires 95% less land and creates 87% less greenhouse gas emissions, but some politicians are seething.",theghostecho,8wheh1,1136,85,https://news.sky.com/story/bleeding-vegan-burger-is-an-existential-threat-to-beef-industry-warns-new-zealand-mp-11426830,
494,My favorite winter comfort food - veggie pot pie filling with cheesy biscuits baked on top,weebling,t2qrqj,1131,23,https://i.redd.it/8q24p2f6bek81.jpg,
495,"Crab Cakes, but made from Lion's Mane mushrooms! So good!",bokchoybaby2,md6bgv,1134,52,https://www.reddit.com/gallery/md6bgv,
496,Arnold Schwarzenegger is going MEAT FREE,jasminesoraya,ch2jk4,1126,72,https://www.youtube.com/watch?v=ImiicK5hTCw&amp=&feature=youtu.be,
497,"My sushi rolls are slightly improving, there’s a learning curve for sure. These tasted awesome, though.",,lsvvmc,1130,92,https://i.redd.it/bd194ogl5tj61.jpg,
498,Spending my isolation making all the foods I didn't have time to cook from scratch. Tonight's meal: Vegetarian French Onion Soup!,fruggledug,fny2qy,1132,34,https://i.redd.it/uaf4dgmbijo41.jpg,
499,Chickpea fajita w/smoked paprika,onlyforjazzmemes,fkpwm9,1127,27,https://i.redd.it/sgcsddiysfn41.jpg,
500,Daily meat consumption in the UK has fallen by 17% in the last decade,Yerfsmaddaw,q3uqft,1123,56,https://www.bbc.co.uk/news/science-environment-58831636.amp,
