,Title,Author,ID,Score,Total Comments,Post URL,Post Text
294,"I've only been vegetarian for a few weeks, so my family was skeptical when I told them I was going to make grilled Cauliflower at our barbecue. They ended up finishing the cauliflower before the brisket!",st_pugsley,c7i13j,1370,30,https://i.imgur.com/ftJX54o.jpg,
295,Crossposted,FinleyCastello,9aqkob,1367,51,https://imgur.com/G9yOryA.jpg,
296,Use cookie cutters on your tofu,MHoaglund41,mnvhqi,1362,36,https://www.reddit.com/gallery/mnvhqi,
297,Merry Christmas to everyone with families that forgot you were vegetarian,cooltop101,efb3qb,1357,139,https://i.redd.it/danuo9vu3p641.jpg,
298,McDonalds plant based options in Netherlands…step it up US!,suzanner99,z3658b,1357,186,https://i.redd.it/k1s7hituau1a1.jpg,
299,This guy...,Anonymoos4804,7ivd4j,1361,20,https://i.redd.it/j5xqxekqu4301.jpg,
300,This is my rainbow vegetarian sandwich. It is the greatest sandwich I have or will ever make.,anagoge,aspoqv,1352,64,https://i.imgur.com/6Fj5wCx.jpg,
301,"Falafel, hummus, herbed yogurt, naan, and a cucumber and tomato salad. Can somebody say YUMMMMM!",erabd,o99925,1343,44,https://www.reddit.com/gallery/o99925,
302,This “seared scallop” (actually a king oyster mushroom) that I made for dinner recently,Mint-slice,b3p8xv,1350,62,https://i.redd.it/w3l2pvy5ggn21.jpg,
303,Meat Eaters Ate 216 Million Vegan Burgers So Far This Year,skulloflugosi,ctrfr3,1350,93,https://www.livekindly.com/meat-eaters-ate-216-million-vegan-burgers-this-year/?fbclid=IwAR0vih39bxEU5LHRtmLclk0Djzt1y6Q2VoIpN-MtLevmckpK8kXF8vrH7Uw,
304,Gotta build that arsenal,thedoctorcat,ige4p9,1343,64,https://i.redd.it/ec91b9tz06j51.jpg,
305,My local coles jumping on the bandwagon!,hurricaneswain,chnh9a,1343,67,https://i.redd.it/6wg3xvvt8gc31.jpg,
306,The last one makes me cringe so hard,Aleatorytanowls,oqzhrs,1343,107,https://i.redd.it/iynxgeeck8d71.jpg,
307,Who can relate?,OrangeInkStain,n9veuy,1344,77,https://v.redd.it/3w35vs0dwey61,
308,Braised tofu with sides,p_e_a_c_h_p_i_e23,fnjvux,1345,45,https://i.redd.it/lm97zuaebfo41.jpg,
309,Vegan dumplings for Chinese New Year!,banoctopus,evfahd,1347,27,https://i.redd.it/s0ee91dqbmd41.jpg,
310,Completely from scratch vegetarian ramen,X_ENV_x,ilf7aq,1346,88,https://i.redd.it/n3fqfg0nqsk51.jpg,
311,Don't you dare take hummus away from us. It's all we have.,,68w9e0,1337,133,https://i.redd.it/90veb8j8u5vy.jpg,
312,"I am disgusted by industrial egg farming practices, but I didn't know how to avoid them whilist still having eggs, so I linked up with someone locally who has pet chickens, and I'll be buying from them from now on! Happier eggs taste so much better!",Laprasnomore,dwxkg0,1335,186,https://i.redd.it/nowi82lz8xy31.jpg,
313,Taco Bell pro tip: Ask for a Quesarito with potatoes instead of meat. So good.,hiimgretchen,d96bxg,1338,131,https://i.redd.it/pid3f2d9wro31.jpg,
314,"She’s beauty, she’s grace",Littlestuartlil,os6c34,1340,36,https://i.redd.it/oztsc3zi1md71.jpg,
315,Shout out to the waitress who saved my dumb self from eating a veggie burger topped with meat.,biologynerd3,fc58hu,1334,68,https://www.reddit.com/r/vegetarian/comments/fc58hu/shout_out_to_the_waitress_who_saved_my_dumb_self/,"Ordered a burger tonight, and asked her to make it beyond meat. The burger was topped with chili and sounded delicious. I ordered the burger and she asked me ""...Do you want the veggie chili?""

And my brain kind of sputtered for a second before I remembered that most of the world makes chili with meat, not just a bunch of beans.

Genuinely grateful that she cared to check. She didn't have to. And also that they make a veggie chili for this! Such a great burger joint."
316,this is the crispiest tofu ive ever achieved!! so happy with my airfryer. ill link the recipe i used below,ojjii,jikuzk,1332,68,https://i.redd.it/nfvv32gbmhv51.jpg,
317,My school( university of Nebraska Omaha) has an impossible cheeseburger pizza for the weekly special! It looks so yummy so I had to grab a slice,tniel11,d2ag1v,1333,94,https://i.redd.it/2kjmpyvvqsl31.jpg,
318,I'm starting to see vegetarian versions of items right next to the meat counterparts in regular isles and not hidden away in a small vegan/vegetarian section and it's great,gardenhead23,n2p2nz,1331,52,https://i.redd.it/v1vm8k5i5kw61.jpg,
319,I can’t wait to break vegan!,mewithoutjew,ju7w2u,1333,171,https://www.reddit.com/r/vegetarian/comments/ju7w2u/i_cant_wait_to_break_vegan/,"A lot of my vegan friends are giving me so much shit and literally threatening our friendship right now so I’m just ranting here, sorry!

I went vegetarian when I was 8, then vegan at 17. I’m 27 now and still vegan. It’s something I honestly thought I would take to my grave because I felt and feel so passionately about animal rights and knowing where your food is grown. 

But then.... I got chickens. 

I have two beautiful hens. I got them in July as day old chicks, which means they’re 22 weeks old now. This means any day now, I could have fresh eggs. 

When I first got them I had no interest in their future eggs. I assumed I would give them to neighbors or drop them off in my local community fridge. The more I care for them and spend time with them, though, the more I want to eat their eggs. 

SO I WILL, GOD DAMMIT. 

These eggs will be a labor of love from all of us, and I will be so proud to break a decade of veganism to eat an egg my girls and I made. Fuck my vegan friends who don’t support me, I’m happy to go back to just being vegetarian!"
320,Happy to see lots of available options at my nearby grocery store.,mattfromseattle,eu9g1k,1323,106,https://i.redd.it/uw4s8usao5d41.jpg,
321,"Sent a simple inquiry to find out whether their cheese was vegetarian or not, got this unnecessarily aggressive response",Char1e3,e1muqn,1319,283,https://i.redd.it/qxelrfb4fw041.jpg,
322,"""Honey butter chicken"" actually maple glazed tofu. Astounding dinner.",,datazo,1322,34,https://imgur.com/0qFbPld.jpg,
323,I made chickpea “meatball” subs that were way better than their non-veg counterpart! (recipes used in comments),littlestoflks,apk7qy,1328,70,https://i.redd.it/h0m0wzi5vzf21.jpg,
324,When you are told there would be vegetarian options to a bbq...,diceman898,91u2y5,1328,197,https://i.redd.it/klfylrmgt4c11.jpg,
325,Herby Garlicky Buttery Balsamic Mushroom Ravioli.. I mean come onnnn,Kforce126,d09lnf,1320,46,https://i.redd.it/593w1s4nhvk31.jpg,
326,Black bean chimichangas with queso,fake_geologist,g3qm9k,1322,33,https://i.redd.it/odkcr2bfvlt41.jpg,
327,"""Why aren't vegetarian meatballs called vegeteballs""",goatsnboots,gjpyqm,1322,75,https://www.reddit.com/r/vegetarian/comments/gjpyqm/why_arent_vegetarian_meatballs_called_vegeteballs/,-- my boyfriend today while making dinner
328,Celebrating my first month of being vegetarian with a veggie burger!,JalilOghuz,b5r262,1314,107,https://i.redd.it/46fwfm3jeho21.jpg,
329,It just makes sense!,ProzacInChickenMeat,egdfav,1318,88,https://i.redd.it/19jk7so8g7741.jpg,
330,"Warning - Be wary of ordering the Beyond Sausage from Pizza Hut, may contain traces of meat.",go_out_stay_home,jsyvyn,1313,142,https://www.reddit.com/r/vegetarian/comments/jsyvyn/warning_be_wary_of_ordering_the_beyond_sausage/,"I work at a Pizza Hut. For meat toppings we use a designated measuring cup to pour all meats onto the pizzas. This cup is rarely washed until the end of the day and often small pieces of meat are left inside of it so, for instance, small pieces of beef can be found in a pizza with pork just because the same cup was used. We have not been given a designated measuring cup for the Beyond Sausage as of yet - I'm not sure if we ever will - and we have been instructed to use the meat cup to pour the Beyond Sausage onto all pizzas. 


I don't know if it's like this for every Pizza Hut restaurant serving the Sausage but I just thought I'd let you all know."
331,Anyone interested in vegan Tiramisu?,CheloniaMydas,gs9trl,1319,30,https://i.redd.it/yag4fnl6cj151.jpg,
332,"Halloumi sandwich w/ spinach, red onion, cucumber, and hummus",address-unknown,kxcb9m,1312,56,https://i.redd.it/j9qovcodjcb61.jpg,
333,"Got a lot of hate for posting this on r/pics but I really believe in this movement! Seattle, WA",mammothbeaver,d702qp,1311,138,https://i.redd.it/2k0e5qnuysn31.jpg,
334,"[I made] Cauliflower, potato and red lentil curry, with jasmin rice, cucumber raita and naan.",RaveTave,beni42,1314,49,https://i.redd.it/ww6k1ej6t1t21.jpg,
335,ALDI Release New Vegan Line to Give Shoppers ‘What They Want’,lnfinity,7mu8vs,1312,97,https://www.livekindly.co/aldi-vegan-line/amp/,
336,“Shepherds” Pie! With beautiful piped mashed potatoes!,DrJanItorPhD,fs1g2i,1303,46,https://i.redd.it/lv7gclu26wp41.jpg,
337,Animals have feelings too.,,8zxyhe,1310,73,https://i.redd.it/uvkrj36zzqa11.png,
338,the start of a beautiful broth,gdesuyis,hxpmst,1312,40,https://i.redd.it/2icb3d9n61d51.jpg,
339,Making fried ‘chicken’ from wheat dough,sumpuran,lox67e,1310,101,https://np.reddit.com/r/blackmagicfuckery/comments/low7xw/turning_flour_into_chicken/,
340,Garbanzos can't be beat,TheBananaBerryBandit,c9nsiq,1301,218,https://i.redd.it/q5x30l944l831.jpg,
341,"If you're ever in Atlanta, you need to try Soul Vegetarian. Everything there is vegan and they have so many delicious options",vintagepop,lzwwfp,1302,51,https://i.redd.it/l0xptsdqjnl61.jpg,
342,"Simple vegetarian burger: halloumi, mushrooms, bell peppers, avocado and spicy mayo",579red,le59oc,1298,39,https://i.redd.it/i0rwutm9wwf61.jpg,
343,"I hate how pizza places have seasoned, prepared meats as toppings but then just raw, unseasoned, bland-ass veggies",,kmnzbj,1306,122,https://www.reddit.com/r/vegetarian/comments/kmnzbj/i_hate_how_pizza_places_have_seasoned_prepared/,the veggie pizza is always bland and soggy
344,Camping with Carnivores,rainingolivia,jctuoe,1297,92,https://www.reddit.com/r/vegetarian/comments/jctuoe/camping_with_carnivores/,"I'm going camping with a few friends this weekend. I knew I was the only vegetarian so while they were talking groceries and meal planning, I was making my own list in order to feed myself. They asked if I needed any items picked up from the store, I said I didn't and explained that I was planning to bring my own food for meals. Upon realizing I'd have to cook my own stuff separately, they (5 meat-eating people) decided to make this 3 night, 4 day camping trip vegetarian.

I told them there was no need, I can handle feeding myself to suit my dietary restrictions, but they insisted. I'm feeling very thankful for these supportive, lovely people in my life and am excited to share some of my camp-friendly vegetarian favorites with them!"
345,A short love poem for lentils,,onrab3,1298,23,https://i.redd.it/51qgzh4fl9c71.jpg,
346,Stuffed Portobello Mushroom Sandwhich,CheapBlackGlasses,wcvjzk,1296,52,https://i.redd.it/y0wg2rk47ye91.jpg,Details in comments!
347,"Thought I would share my favorite ‘dilla. I’m not vegan, but this baby is and it’s delicious. Mashed avocado, black beans, caramelized onions and nutritional yeast.",thefiminator,i0veiz,1294,50,https://i.redd.it/5kzy5dncj2e51.jpg,
348,Indian Comfort Food: Chole and Aloo Puri,kaizadr,isyx2l,1293,50,https://i.redd.it/ayg1gm2js7n51.jpg,
349,"I haven't spent a single $ on meat in 2020. A small accomplishment, but it feels great.",hazboobs,eyaif0,1294,36,https://www.reddit.com/r/vegetarian/comments/eyaif0/i_havent_spent_a_single_on_meat_in_2020_a_small/,"I decided that a nice start to my journey would be to establish a personal rule of not spending any money on meat.  I've had many cravings for some of my favorite fast food (mostly fried chicken and burgers) but haven't caved in once.  I have had meat a few times, mostly a few of my boyfriend's Popeye's leftovers.  I haven't been calling myself a vegetarian since I don't want to claim that term until I'm actually not eating meat as a rule.  

I know this isn't much, but it feels like a really big accomplishment for me.  It feels like my purchasing decisions are finally in line with my environmental and ethical concerns."
350,I made crispy sticky tofu over roasted Brussels sprouts w/rice & tahini,Jassari122410,apxui3,1299,40,https://i.redd.it/jztfvgc667g21.jpg,
351,Vegan Beyond Burger Outsells Beef in Major Supermarket’s Meat Case,lnfinity,8ivy6x,1293,110,https://www.livekindly.co/vegan-beyond-burger-outsells-beef-at-major-supermarkets-meat-case/amp/,
352,"Wife and I were missing bar food, so we made our own :-) Field Roast burger and Chili",wgn_luv,k98ude,1293,51,https://i.imgur.com/kxxwHFO.jpg,
353,"I'm trying to like eggplant more, so I made ratatouille. Will definitely make again!",TaxMansMom,bgn9ji,1288,101,https://i.redd.it/0fsbozddl3u21.jpg,
354,KFC is releasing Beyond chicken nuggets in the states and released this statement saying they are vegetarian or vegan. Don’t fall for it! This is a screenshot straight from their website,mvargas619,ht21dq,1285,281,https://i.redd.it/fwlke3fdxgb51.jpg,
355,Costco has a new pea protein based taco meat replacement,ElectronGuru,10jrp59,1287,109,https://i.imgur.com/TjhoJUl.jpg,
356,Who needs an expensive tofu press when you have expensive nursing textbooks?,mikewazowski_0912,f9n8qs,1291,60,https://i.redd.it/u9r5f5sky6j41.jpg,
357,Beyond Meat CEO Reveals Vegan Steak Will Be Available This Year,skulloflugosi,vtpesc,1284,169,https://thebeet.com/beyond-meat-steak/?utm_source=tsmclip&utm_medium=referral&fbclid=IwAR1DeDc40Z0qnRU_Wm6WjhoZcoCOGBsHHyycOxBuKWSBGG4PsXOu5P6jn3w,
358,Just made an organic Mediterranean salad.,1n51d3L1ght,msdmu2,1278,25,https://i.imgur.com/74OKeKr.jpg,
359,It’s funny because it’s true,Filip_of_Westeros,elrcig,1277,88,https://i.redd.it/kb8p1i3rcj941.jpg,
360,Proud to say that I'm 5 years meat free.,jevs1369,bobt3t,1274,85,https://imgur.com/V3CnuEn,
361,"Breakfast pizza with caramelized onions, goat cheese and eggs.",Yunocookin,eii9rn,1273,70,https://i.redd.it/pzcfro4546841.jpg,
362,Disney World and Disneyland are adding hundreds of new plant based dishes to their menus,alimm25,d8puq4,1278,40,https://disneyparks.disney.go.com/blog/2019/09/hundreds-of-plant-based-dishes-are-coming-to-walt-disney-world-and-disneyland-resorts/,
363,When the meat replacement doesn't taste like meat,ceruleanbluish,mat1al,1274,64,https://i.redd.it/kv4iqr4t6mo61.png,
364,"Graduated with my LLM in tax this week, hows my new tofu press look!!!!",badgyalsammy,gin14z,1270,30,https://i.redd.it/c0mbl5mv4fy41.jpg,
365,"Garlic Naan, Hummus, Chopped Veg",streetsy,azjibk,1266,27,https://i.imgur.com/WsdEaHk.jpg,
366,Homemade Bread-Bowl and Broccoli Cheese Soup.,chocolateshipcookies,im4qh9,1268,50,https://i.redd.it/ec465r1oo0l51.jpg,
367,Today's lunch: Vegetarian paella,DrFrankenDerpen,i1q9ez,1267,43,https://i.redd.it/ekc4okmdcde51.jpg,
368,2.5 Million Australians No Longer Eat Meat!,textunes,bfvlk4,1265,59,https://i.redd.it/5jui0ru3lpt21.jpg,
369,Made this crispy buffalo tofu today... amazing!!,killFangkill,gkh2yx,1259,36,https://i.redd.it/g5d8g2pwpzy41.jpg,
370,Impossible/Beyond Has Ruined Veggie Burgers,jeffzacharias,sexawx,1254,326,https://www.reddit.com/r/vegetarian/comments/sexawx/impossiblebeyond_has_ruined_veggie_burgers/,"For many years I have liked just about any veggie burger I have had and often look forward to having them at restaurants. Then came Impossible and Beyond burgers that have tried to imitate what real beef tastes like.  This may be great for meat lovers who want to not eat meat, but it’s not great for someone like me to have a veggie burger that tastes like beef. I don’t like these nearly as much and I really can’t eat a Beyond burger. So many restaurants are now serving Impossible or Beyond burgers instead of their previous veggie burger that it has ruined veggie burgers for me."
371,My wife's homemade breakfast burritos.,peacefulatheism,jha5xg,1257,22,https://i.redd.it/l6tyrepq22v51.jpg,
372,Vegan options offered at weddings,kennedyBeach,z888rw,1246,238,https://i.redd.it/axisfxl1c03a1.jpg,"I went to a wedding this past weekend and was pretty pleased to be offered, among the chicken and the fish and the beef, a tofu option. I jumped on it immediately. It was delicious, it sparked conversation at the table, and it shows me that the number of people choosing healthier options is growing."
373,Once I found out how easy buffalo cauliflower was to make...,Hotter-Otter70,11dk2if,1247,102,https://i.redd.it/ipvx7kmrntka1.jpg,
374,Constant cravings now,JBonanza,e95i83,1250,42,https://i.redd.it/y756wqycgz341.jpg,
375,Best ever crispy sesame tofu!,luvs2meow,b9jst6,1247,46,https://i.redd.it/w65i79hbybq21.jpg,
376,KFC launched their veggie burger today and it seems like it was a hit. Very disappointed I didn't get to try it.,faith_plus_one,c1u6za,1249,114,https://imgur.com/SXu55Gj.jpg,
377,One year vegetarian anniversary,madallina-13,mw6o4q,1242,34,https://i.redd.it/ejg9xj4uoqu61.jpg,
378,I made this Thai Curry Soup for lunch and it was too good to not share.,globewithwords,iospkj,1247,28,https://i.redd.it/0ro2ll8j4xl51.jpg,
379,Was feeling lonely so I decided to make myself a little bear friend :””) ft. SeiTan-Katsu and Japanese Curry!!,_she_loves_you_,c214k2,1241,23,https://i.redd.it/jjqc9ni3p3531.jpg,
380,"Veggie platter- Falafel, Halloumi, grilled veg!",smugsy1,afaexc,1243,30,https://i.redd.it/13nbfcyvh1a21.jpg,
381,"The humble cheese sandwich. Sharp cheddar (the expensive kind), lettuce, tomato, onion, and Grey Poupon on a soft potato roll. What more could you want?",misspygmy,ibmqzq,1250,119,https://i.redd.it/dj3l18ddmmh51.jpg,
382,My favourite type of platter at the moment. Summer fruits and Puhoi lemon curd yoghurt from New Zealand,emma_lee99,f0g5z6,1243,39,https://i.redd.it/omqlc7828kf41.jpg,
383,KFC Canada Sells Out of Vegan Chicken in Six Hours,Wr4thofkhan,e5m1rx,1243,60,https://vegnews.com/2019/12/kfc-canada-sells-out-of-vegan-chicken-in-six-hours,
384,Chicken fried cauliflower steak with mushroom gravy. Really surprised how great it turned out!,jems404,jgntdc,1243,48,https://i.redd.it/l4fwrbvuquu51.jpg,
385,Vegan butternut squash mac & cheese with brussel sprouts,Clau_9,dxepsf,1238,31,https://i.imgur.com/2HkydC9.jpg,
386,"Delicious spread from a Cuban restaurant in Louisville Kentucky. Beans and rice, fried plantain,yucca fries, and empanadas. So filling!",stargazer612,cystwu,1248,36,https://i.redd.it/b1xr03ru38k31.jpg,
387,"It finally feels like soup season in SF, so here is some grilled cheese and spicy tomato soup",double__negative,j6xt15,1247,23,https://i.imgur.com/2Rq4E1t.jpg,
388,2019 was pretty shitty but I learned how to make hollandaise so not a total loss,,eizuiw,1238,49,https://i.redd.it/7wtupkohzd841.jpg,
389,A little trick for black bean burgers. Use a mason jar lid to keep the party shape.,Stammbomb,jfixjl,1241,69,https://i.redd.it/kowzjof5uhu51.jpg,
390,Polish Apple Pancakes (Racuchy z Jabłkami),mienczaczek,kz4nn5,1235,39,https://i.redd.it/yj22waonlvb61.jpg,
391,Spicy Buffalo tofu salad - omg so good!,feelicky,grv2lf,1231,41,https://i.redd.it/bjch7i139e151.jpg,
392,Afghan food in Zurich,Vuares,m6ius3,1237,53,https://i.redd.it/ekgr59subgn61.jpg,
393,My mom after I tell her I don’t want a cheeseburger with them cause l’ve stopped eating meat.,matryoshka_nikita,cg0sw2,1230,94,https://i.redd.it/sodoy0n9nob31.jpg,
394,Thought this was pretty cool,msilly34,8xehth,1235,63,https://i.redd.it/p4tcgjsnsy811.jpg,
395,Vegetarian breakfast hash and mimosas for a snowy Sunday morning,TheConeyJabroni,f8e1ba,1228,52,https://i.redd.it/gr6100362qi41.jpg,
396,my effort at vegetarian ramen,deanwinchest3r,yzcvzg,1232,49,https://i.redd.it/x0x68crsjy0a1.jpg,
397,My first ever veggie bean chili on my quest to be completely vegetarian by the end of the year,HowlingCrow,byp1hn,1227,63,https://i.redd.it/uab49k19ae331.jpg,
398,Breakfast this morning!,isabella929,fbd4ee,1233,29,https://i.redd.it/0ok95m0jgvj41.jpg,
399,A veggie diet has been the only thing that has helped with my IBS-D. I keep this helpful reminder on my phone to look at whenever I crave chick fil a.,ScoobyDoobieBlue,hekhpf,1228,84,https://i.redd.it/iah09m6thp651.jpg,
400,Vegetarian Showerthought: It would be great if more vegans treated vegetarians half as well as they do corporations.,verdantsf,amtpae,1224,308,https://www.reddit.com/r/vegetarian/comments/amtpae/vegetarian_showerthought_it_would_be_great_if/,"Specifically, when talking about a corporation that still sells meat, eggs, and dairy, but offers a single vegan option, there's fanfare and kudos. ""Progress!"" When talking about vegetarians, there's a hue and cry. ""Not enough!"" 

&#x200B;"
401,Homemade Pizza (dough and tomato sauce from scratch),Snoo_67676,jm1f72,1224,28,https://i.redd.it/00ffaa9hgmw51.jpg,
402,Thought this was a cute take on that old 'Got Milk?' ad campaign. 2019 is the year of the dairy-free substitute,,b2pz44,1223,133,https://i.imgur.com/JjSoWh9.jpg,
403,I work at Dunkin and my manager seriously overestimated how many Beyond sausage patties we would need for launch weekend. Lucky me.,Danger_Muffins,duwox6,1224,127,https://i.redd.it/p2bqb0aeq3y31.jpg,
404,Sriracha and soy sauce baked tofu,,b0agte,1225,49,https://imgur.com/mO6mHOB,
405,Spicy sweet potato-carrot soup with grilled cheese,,xwpwuq,1224,46,https://i.imgur.com/vmcG1zB.jpg,
406,We didn’t want to fry our falafel so we decided to waffle it instead! Came out amazing!!!,lompocmatt,lsbjyn,1220,59,https://i.redd.it/6vk0y17rpnj61.jpg,
407,Del Taco Adds Vegan Beyond Meat Tacos to 16 San Diego Locations,quellik,a5jvv7,1221,54,https://vegnews.com/2018/12/del-taco-adds-vegan-beyond-meat-tacos-to-16-san-diego-locations,
408,Everything on this plate is homemade except the feta. Super happy with my first attempt at falafel and pita!,bmbell11,ic273h,1220,62,https://i.redd.it/0141yf4uvrh51.jpg,
409,Tonight's mozzarella basil sandwiches,manicpixiegoblin,htcgzj,1216,21,https://i.redd.it/pju6oyt7fkb51.jpg,
410,Praise the name of seitan!,Jindeed,mfsl9p,1213,70,https://i.redd.it/7pfczxbkozp61.jpg,
411,"Finally I”m at the cutting edge of food, The winner of the UK National Pie contest is GF and vegetarian",kungfumovielady,ukzldz,1216,53,https://i.redd.it/uo7i218hk8y81.jpg,
412,Brought the heat for dinner: Nashville hot tofu over jalapeño cheddar corn grits,miso__mama,g6z6fd,1215,41,https://i.redd.it/6flnwltu2ou41.jpg,
413,"Taco Bell has a new menu dedicated to vegetarians, including meatless versions of the Crunchwrap Supreme and Quesarito",sumpuran,d2m6ay,1212,126,https://www.insider.com/taco-bell-launching-new-menu-just-for-vegetarians-2019-9,
414,"My mum went grocery shopping and although I didn’t ask for anything, she came home with this. I don’t think I’ll ever find someone who loves me as much as she does. ♡",_she_loves_you_,9zy47x,1218,105,https://i.redd.it/9wmnkl0xv9021.jpg,
415,Love that Target has a section for plant-based foods (with huge labels!),lencat,o34kwx,1211,77,https://www.reddit.com/gallery/o34kwx,
416,Another win for the good guys!,desstiaj03,inedr8,1210,129,https://i.redd.it/u6xakgxrxfl51.jpg,
417,"I don’t own a tofu press, but I do own a George Foreman grill",squishchef,nfl270,1202,80,https://www.reddit.com/gallery/nfl270,
418,Another vegetarian ramen today (w/ fried tofu and mushrooms),radmax1997,lmvemr,1205,53,https://i.redd.it/e3bhoesdiai61.jpg,
419,Made my first lot of tortellini from scratch. How'd I do?,magicmoose1,p6xoaj,1201,32,https://i.redd.it/9omiq0ajy5i71.jpg,
420,"Lovely dinner my wife made us. Bed of baby spinach, farro, roasted carrots, roasted potatoes (seasoned w/ smoked paprika and cayenne), roasted broccoli (seasoned w/ garlic), pan fried tempeh (seasoned w/ sweet baby ray's). 10/10",sudokillallHUMANS,ayfgm7,1208,51,https://i.redd.it/ofbdsigmhqk21.jpg,
421,I was mocked at work today,,ed4mkl,1201,302,https://www.reddit.com/r/vegetarian/comments/ed4mkl/i_was_mocked_at_work_today/,"I signed up for the company christmas potluck. Everyone including my bosses mocked, ridiculed, and refused to eat my vegetarian chili. I guess a year ago i might've joked too, but I would've at least tried it. 

The people who didn't know it was vegetarian had no idea it didn't contain meat, I guess i should've been smarter and not mentioned it was vegetarian.

I've spent my entire life studying food science and cooking. It's my passion. I guess these people don't realize I went shopping for fresh ingredients and stayed up all night cooking. That or they don't care. I don't know. I don't care. I'm feeling so dejected.

Advice?

Edit: Thank you all so much for the wonderful advice! It's very refreshing to resonate with so many people and know that this community can relate. From the love to the hate, all of your comments are appreciated. I've taken everything into consideration and I've decided to keep moving forward with my goals and not let one bad experience sour my passion!

For everyone who requested the [recipe](https://www.reddit.com/r/vegetarian/comments/dxhvj8/been_waiting_for_this_since_that_big_cold_front/?utm_medium=android_app&utm_source=share) here is the link from the original post. The only thing I changed was nixing the Worcestershire sauce and instead soaking the baby bellas in olive oil and black pepper. ¡Para servirle, para salud! I love you all!"
