,Title,Author,ID,Score,Total Comments,Post URL,Post Text
153,"I’ve been vegetarian for almost 2 years. Today, we recieved out family’s blood test results.",Gabriel-YP,imr8yw,1692,203,https://www.reddit.com/r/vegetarian/comments/imr8yw/ive_been_vegetarian_for_almost_2_years_today_we/,"Everyone thought I was going to be one of the lowest in protein and B12, but apparently im the one with highest level! Now I can say I’m a living proof that being vegetarian doesn’t mean being unhealthy lol

Sorry if this is irrelevant, I just wanted to share!"
154,Spent 5 minutes looking for Beyond Burgers only to realize Sprouts has a full display of plant-based meats.,lovelykla,d633x9,1697,100,https://i.redd.it/9lqx2lklpen31.jpg,
155,Vegans are out of control in here,atomicspace,a4rzbl,1698,5,https://www.reddit.com/r/vegetarian/comments/a4rzbl/vegans_are_out_of_control_in_here/,"Please let vegetarians be vegetarians.  There already exists a /r/Vegan - why not go be vegan there?

Vegetarians aren’t not-yet-woke vegans.  We’re just vegetarians.

Stop battering, belittling, and proselytizing people because they’re different than you."
156,The tofu aisle at my local Asian grocery,GingersaurusRex,pns325,1696,97,https://v.redd.it/17vpw6w46dn71,
157,Realized my family’s Easter brunch was unintentionally 100% vegetarian and I (the only vegetarian in the family) am here for it!,,mk0mvw,1685,40,https://i.redd.it/n22xk0fdy6r61.jpg,
158,Cauliflower Parmigiana! The Aussie Pub Classic made vego,Crottison,kuz1cg,1690,83,https://v.redd.it/hyy64zsj4oa61,
159,Who would be excited to see the return of real veggie burgers? Like burgers made with actual ingredients rather than the Beyond and Impossible burgers?,JBT_Lover,10noxet,1687,302,https://www.reddit.com/r/vegetarian/comments/10noxet/who_would_be_excited_to_see_the_return_of_real/,"I’ve seen a couple articles now about how the faux meat industry is seeing a big downturn and I would like to see that niche filled in with actual veggie burgers. 

Like give me a hearty lentil, rice and veg mix burger at a reasonable price with ingredients I can understand and pronounce already! And I wish restaurants would go back to trying instead of just slapping a Beyond burger on the menu and calling it good for vegetarians. I miss places that had homemade black bean burgers or wild rice burgers or interesting veggie sandwiches or pasta available.  We deserve better."
160,Beyond Meat has never let me down,Volunteer-Pillager,iitcm5,1682,109,https://i.redd.it/ti9wlf0ucyj51.jpg,
161,Go Tufu!,babybear976,h0fdmw,1677,68,https://i.redd.it/yx5ompwg94451.jpg,
162,When your fake meat starts looking like man meat. I’ll stick to the other vegetarian proteins thank you.,Slizzlightening,iccauc,1678,130,https://i.redd.it/1h3o8c0biuh51.jpg,
163,Shout out to all my fellow vegetarians today who sit there and eat mashed potatoes while people ask you why you aren’t eating turkey. I feel ya.,Uhhlaneuh,7eztod,1675,363,https://www.reddit.com/r/vegetarian/comments/7eztod/shout_out_to_all_my_fellow_vegetarians_today_who/,
164,"April 20th, I will be a vegetarian for twenty years!",miss_chaos,mhw02e,1677,175,https://i.redd.it/sdfdpttpjkq61.jpg,
165,Today’s tofu pressing station,lrc2188,fwo8lv,1672,117,https://i.redd.it/bdvv1hs4hfr41.jpg,
166,Considerate hosts appreciation thread!,wild3hills,104kdpi,1667,74,https://i.imgur.com/wrlW09b.jpg,
167,No meat Tom Yum soup with zucchini noodles (recipe inside),abaganoush,f492ot,1672,38,https://i.redd.it/jcvy26w453h41.jpg,
168,"Paul McCartney, who is a vegetarian and animal rights activist, only agreed to appear on The Simpsons if Lisa's decision to become a vegetarian in that episode was made permanent. He is the reason Lisa is still a vegetarian.",perpetualnotion,avcoso,1668,19,https://www.portablepress.com/blog/2015/11/paul-mccartneys-backward-lentil-soup/,
169,All vegetarian picnic with friends!,GingersaurusRex,ntnv4t,1667,75,https://i.redd.it/li0eypdovn371.jpg,
170,Vegans be like...,ham_solo,bjr5gp,1666,36,https://i.redd.it/st24gblxdqv21.jpg,
171,"Ramen with crispy tofu, glazed carrots, soft boiled egg, and seared baby bok choy",omgzunicorns,eomglg,1653,47,https://i.redd.it/i3e8jh7dfra41.jpg,
172,"Taco Bell Tests Vegetarian Menu, Offers Vegetarian Quesarito and Veggie Crunchwrap",glorfindel34,b8wsx5,1657,125,https://www.delish.com/food-news/a25858386/taco-bell-testing-vegetarian-vegan-menu/,
173,"Probably a bit early for Halloween, but...",TheBuddhistTraveler,pr7gwt,1642,39,https://i.redd.it/x4pbg03zjgo71.jpg,
174,Veggie sandwich,AcidRaine122,g5or6m,1647,37,https://i.redd.it/xcr7tlnmu8u41.jpg,
175,"After tons of experimenting, I finally made seitan that replicates the texture & feel of real chicken! I’m so excited, that I had to share a video of it in ripping action.",MasterUnholyWar,jmj9do,1641,151,https://v.redd.it/718vs8xt4sw51,
176,New grocery store find today,yourgirlalex,iiiqm7,1639,89,https://i.redd.it/1omyheiv3uj51.jpg,
177,"Planters has recently started using gelatin in their dry-roasted peanuts. If you use these in recipes or for vegetarian snacking, check labels and choose other brands. (USA).",grain7grain,hc3h0r,1638,172,https://i.redd.it/5sk1w5zx4w551.jpg,
178,2020 sucks but check out this new junk food.,Spooky__spaghetti,jbm2av,1629,101,https://i.redd.it/4t1w0yhry8t51.jpg,
179,Another quality $1.50 lunch set in Vietnam ✌️,AeonGaiden,axlis1,1627,60,https://i.redd.it/6pp90oy45bk21.jpg,
180,"A Few Vegetarian Dishes I Ate in Sicily, Italy",FearlessTravels,vb0j0s,1617,84,https://www.reddit.com/gallery/vb0j0s,
181,Butternut squash ravioli I made recently,1n51d3L1ght,idy2ww,1618,43,https://i.imgur.com/YvcrIdw.jpg,
182,They get me every time [OC],smolbeanlydia,auuyt3,1621,38,https://i.redd.it/mg7wul3taui21.jpg,
183,6 months of meat free cooking!,Howdy-Cowgirl,mgn3ai,1607,59,https://i.redd.it/teloz5m3p7q61.jpg,
184,Nice of Giant to organize 75% of my diet into a single isle,Cheomesh,x73hfo,1606,51,https://i.redd.it/u18eesic88m91.jpg,
185,"Got a $9 vegetarian “sandwich” from a local cafe. There was suppose to be blue cheese, sprouts & hummus on it as well but instead all it had was cucumber, lettuce and tomato. That’s it.",blackbeanthedog,mot7z7,1609,213,https://i.redd.it/49j5h0kbgks61.jpg,
186,I’m addicted to roast vegetables! So easy to make and tasty.,gibgod,ek01b8,1602,75,https://i.redd.it/3jl6uca4ys841.jpg,
187,"Indian style veggie pizza with tandoori paneer from Pizza Twist in Las Colinas, TX",1n51d3L1ght,og9nqb,1604,61,https://i.imgur.com/jnLwXhz.jpg,
188,"Meat Consumption Needs to Drop by 90 Percent, Climate Scientists Say",pizzaiolo_,9rk2h0,1605,121,https://interestingengineering.com/meat-consumption-needs-to-drop-by-90-percent-climate-scientists-say?fbclid=IwAR2Aw969H3lhxy3_XZCM4fC23LArkzM6Z4CKhcBoudSEPqoj_sU9HjEjqlE,
189,Sending the good vibes from r/Chipotle,ScorpRex,mq9jc0,1598,55,https://i.redd.it/m1vdx2u65ss61.jpg,
190,"I love animals, not myself",pigmons_balloon,kluvel,1600,91,https://i.redd.it/yo2t1f2mry761.jpg,
191,"Working hard to defeat an eating disorder by finding joy in a vegetarian diet! This community has an incredible amount of beautiful wholesome meals, thank you everyone for sharing! Pic of work snacks for color",DoomCakes42,anvaat,1603,85,https://i.redd.it/uaqlvh9hf0f21.jpg,
192,"By popular demand, here is an entire pineapple in my thrifted rotisserie oven.",,8ey690,1605,80,https://i.imgur.com/uoM5qzv.gifv,
193,Sent this to my friend who poked fun at my decision to be vegetarian. She apologized and said she would re-evaluated her diet!,Mimigonemimi,jnlcp4,1589,26,https://i.redd.it/eoterdnty3x51.jpg,
194,this sub atm,Pili410,e8pn2e,1589,62,https://i.redd.it/lfx8tcc5os341.jpg,
195,Mardi Gras Vegetarian Gumbo!,icanhazkarma17,f9zhi1,1591,71,https://i.redd.it/ru3sz3ektbj41.jpg,
196,The dream,ceruleanbluish,nrnozx,1590,119,https://i.redd.it/s9rxdoky54371.jpg,
197,"@hollycassell on Twitter: “Being veggie, vegan, buying ethically, going cruelty-free, reducing waste, helping the environment, supporting good companies... it's all a journey and a process. The point is to reduce harm, not achieve perfection. Please don't beat yourself up for trying.”",tman612,7shdrd,1590,107,https://twitter.com/hollycassell/status/955493706131562496,
198,I dare you,Murgu007,ensud3,1574,58,https://i.redd.it/s6rh4gzxpea41.jpg,
199,Today marks 100 days of my girlfriend and I being vegetarian. #EatPlants #LoveAnimals,Rickard58,bhckar,1580,53,https://i.redd.it/v67yn9eulgu21.jpg,
200,Amsterdam to serve vegetarian food by default at all council events,,brb1xk,1570,18,https://www.telegraph.co.uk/news/2019/05/21/amsterdam-serve-vegetarian-food-default-council-events/,
201,Any one else love TB?,AustinBotanicals,bn6p3t,1559,110,https://i.redd.it/ubyw2b5smhx21.png,
202,WOW I can actually eat something other than cereal this morning. BIG shoutout to Fairfield by Marriott!!!!,bbysnakes,9dhvvc,1557,91,https://i.redd.it/mda0nlhf0mk11.jpg,
203,"Are we still buying Amy’s? These prices are insane. When I first started eating them about 8 years ago, they were $3.50 each..",musicsexual13,1057m5e,1551,408,https://i.redd.it/wab5msw2jjaa1.jpg,
204,"Tofu haters, I sincerely can not relate.",,a53xh1,1555,125,https://i.redd.it/vtxgbe4j3l321.jpg,
205,IKEA to make 50% of all restaurant dishes plant based by 2025!,rasarota,k0oppq,1549,53,https://www.veganfoodandliving.com/news/ikea-plant-based-restaurant-dishes/,
206,Yeah that’s right. An extra sausage.,roy_disco,cw6jx2,1545,56,https://i.redd.it/isafluvfm0j31.jpg,
207,Homemade Chinese kind of night,_runandbfr33_,khw73o,1548,26,https://i.redd.it/7wbw77ydhn661.jpg,
208,Vegan McPlant burger released by McDonalds today in the UK,youeffohhh,pxy4of,1539,218,https://i.redd.it/7lp8getqqgq71.jpg,
209,Idk why Taco Bell decided to remove so many vegetarian options :(,cagetheblackbird,intk4t,1533,285,https://www.reddit.com/r/vegetarian/comments/intk4t/idk_why_taco_bell_decided_to_remove_so_many/,"It went from my only real vegetarian fast food option to just, “meh.” The potato options were so good, and allowed me to get a diverse amount of food on their menu. Using their beans as a substitute for meat is just not as good (IMO).

All of the BKs by me destroy their impossible whoppers by burning them to a crisp, and I’m never in the test market for anything. Taco Bell was my favorite “on the run” go to. 

Makes me sad, man :(

It’s weird too, because Taco Bell had really cornered that market. I’m not sure why they decided fried potatoes was too much of an over reach."
210,Saving one life at a time,,h9uief,1541,23,https://i.redd.it/saxmj6ypm6551.jpg,
211,creamy mushroom and spinach pasta,Spookysho,hx3xjr,1533,31,https://i.redd.it/v70nc4lbrtc51.jpg,
212,Percentage of Vegetarians per Country,Kunstbanause1,q8slg0,1528,169,https://i.redd.it/ihc93pjy9nt71.jpg,
213,"I thrifted this vertical rotisserie for tacos al pastor right before deciding to go vegetarian, but I'll be damned if I still can't get some use out of this thing.",,8di3h4,1526,60,https://i.imgur.com/pFvJFOT.gifv,
214,"Trying to reduce my meat intake, and made these dope vegetarian tacos.",beernotbabies,au39x1,1518,52,https://i.redd.it/3rixgyxdgfi21.jpg,
215,Maybe not the best example of plant-based food....,5_Frog_Margin,t9uwxd,1523,107,https://i.redd.it/0wn9ey8x39m81.jpg,
216,Scientists urge people to eat less meat amid declaration of climate emergency,mothematic,dtiu3d,1523,147,https://www.independent.co.uk/life-style/food-and-drink/vegan-vegetarian-meat-climate-emergency-scientists-environment-a9185956.html,
217,Tried my hand at making cauliflower wings and two homemade sauces.,AlarmingStatue,fzm0y9,1515,39,https://imgur.com/g7MIYOH.jpg,
218,My first ever vegetarian Thanksgiving turned out to be a huge success! (And it's gluten free too!),a_sad_potater,k22vhs,1516,37,https://i.redd.it/1p7ruum0us161.jpg,
219,Crispy Tofu Bowl,spicycici,hgxexq,1516,41,https://i.redd.it/nri4hpkqkh751.jpg,
220,Ordering tips for the Beyond at Carl’s Jr.,Moonlightoctopus,bs3mle,1515,194,https://i.redd.it/36ipa6o21zz21.jpg,
221,"After a straight week of mushy brownish Thanksgiving leftovers I needed a hard reset. I call this recipe ""oh god I need something green""",SleepyLilBee,k88x58,1507,33,https://i.redd.it/ipfxye67so361.jpg,
222,WWYD: Daughter ordered a Impossible burger at a restaurant...,DelcoInDaHouse,bfdib2,1503,271,https://www.reddit.com/r/vegetarian/comments/bfdib2/wwyd_daughter_ordered_a_impossible_burger_at_a/,"She's not a vegetarian (yet).  She does not care for burgers but was interested in trying an Impossible burger.  She ate it and as we were wrapping up the waiter casually apologizes that he forgot to change the order from a beef patty to an Impossible burger.   She was OK with it,  but I thought to myself that is not something you'd want to mess up with someone that hasnt eaten meat in years."
223,Red Robin launches impossible burger Nation wide!,everforthright36,b6ax2g,1503,122,https://i.redd.it/dd4c7ctqoqo21.png,
224,"mushrooms > chicken. this is a chicken of the woods I foraged , dipped in liquid aminos, rolled in cornstarch, and fried in coconut oil. I ate it tossed in orange sauce :)",tessahazzard,hfeuod,1509,97,https://v.redd.it/xam344me0z651,
225,I never really understood cheese people until I went vegetarian. This was dinner,,kkrowo,1501,73,https://i.redd.it/8s674ofc1m761.jpg,
226,let me have the damn tofu john,bountiful-barracudas,cd97qr,1502,24,https://i.imgur.com/GkZNCWO.jpg,
227,"charlie ""chick pea"" palmer, living the dream",Neebay,6wtc1o,1497,28,https://i.redd.it/tg1s1hexrghz.jpg,
228,My daughter (16) made herbed focaccia and we turned it into lunch.,magnum_chungus,gcw6c1,1497,30,https://i.redd.it/114g033ullw41.jpg,
229,iT jUsT dOeSn’t TaStE LiKe rEaL mEaT,hofoods,netozs,1503,130,https://i.redd.it/kho1e85aarz61.jpg,
230,Some people say they can't imagine giving up meat. I feel the same way about fried potatoes. Patatas bravas with homemade garlic aioli,austinausten,aou66s,1494,39,https://i.redd.it/xcjketw9rkf21.jpg,
231,Beautifully Chalked Bentham Quote,lnfinity,7ua5s7,1492,143,https://i.imgur.com/jk8ZY5r.jpg,
232,month one of (attempting) vegetarianism!,hissing_vassal,si8gpp,1494,138,https://i.redd.it/y7fwc8e2zaf81.jpg,
233,HAIL SEITAN,showtunie,l1k5tl,1490,28,https://i.redd.it/qqwwbrv4ckc61.png,
234,“Vegetarian friendly”,SupportedByTrees,wwpwoc,1489,315,https://i.redd.it/zf22upv88pj91.jpg,
235,impossible,OreoPredator,lwjg94,1487,33,https://i.redd.it/n356zh22ldk41.jpg,
236,This is so sweet :),lentilbeanz,7m21jh,1489,12,https://i.redd.it/hf72v4j7e3601.jpg,
237,"Cheese fondue with roasted baby potatoes, broccoli, cauliflower, mushrooms, and bread.",CaptainWisconsin,1150u6b,1487,70,https://i.redd.it/abty9gez1uia1.jpg,
238,Tofu Tikka Masala,chipsindip,i4pqw3,1482,44,https://i.redd.it/00lnzsxf6df51.jpg,
239,I tried the new Beyond Meat chicken nuggets from A&W. They were amazing!,,eb683s,1489,108,https://i.redd.it/fzh1b698ov441.jpg,
240,I’d like to take this time to publicly thank Taco Bell for being so vegetarian-friendly.,supertired69,dlshnl,1480,130,https://www.reddit.com/r/vegetarian/comments/dlshnl/id_like_to_take_this_time_to_publicly_thank_taco/,"I’m a trash monster and have always loved T-Bell, and my love has only grown since becoming veg. It’s the easiest place to go when I don’t want to cook and I don’t feel like I have to make any compromises with what I want to eat bc it’s so easy to switch to beans! Anyways that’s all I wanted to say, thanks for your time."
241,Caramelised onion and goat cheese tarts with chilli jam,The-Wizard-of-odd,fw01yl,1480,24,https://i.redd.it/tu8mubfkn7r41.jpg,
242,My first attempt at a vegetarian shepherds pie,Lakers_Fan40,k6r4cl,1482,127,https://i.redd.it/rz0hmuolw7361.jpg,
243,I woke up to 49 notifications all about legumes,TheBananaBerryBandit,c9w12k,1477,80,https://i.redd.it/yw2qyw56vp831.jpg,
244,"I support everyone trying to eat less meat, but now I gotta starve, you get me?",GinsengFlavouring,pmd4hl,1477,101,https://i.redd.it/yhyuau4o7xm71.jpg,
245,Gotta love it,TheBlonkParode,mrhxbe,1474,39,https://i.redd.it/2gku0zdw2dt61.png,
246,"[I made] Gyozas / Potstickers . Filled with mushroom, cabbage, carrot and tofu.",-----------0,bjauyz,1471,44,https://i.redd.it/827ewjrfuhv21.jpg,
247,"A year ago on my birthday, I decided to go vegetarian. I've started cutting out eggs and dairy from my diet and celebrated today with this beautiful vegan chocolate cake!",clefairylynn,g12m8y,1472,59,https://i.redd.it/rne2bvsf8rs41.jpg,
248,"It’s been 1 month. Lost five pounds, saved $90, and learned so much.",bubbleheadbob2000,am1zvk,1475,111,https://www.reddit.com/r/vegetarian/comments/am1zvk/its_been_1_month_lost_five_pounds_saved_90_and/,"My teenaged daughter told me in mid-December that she wanted to challenge herself in 2019 and was going to cut meat out of her diet (except seafood). We discussed it and I told her that I would support her by making at least 3 vegetarian meals a week for the family since her brothers didn’t want to make the same lifestyle choices. I told her I would make sure that there was always an option for her to eat but I wouldn’t prepare a separate meal for her on the nights we were having a meat based protein. She had some birthday money left and asked if we could buy some prepared foods for those nights. I compromised and told her I would split the cost because I felt it wasn’t fair for a 15 year old to have to buy her own food. 

She and I researched different menu items and decided that we were going to avoid meat analogs. We found a lot of Indian and East Asian dishes that were either vegetarian by themselves or had meatless options. I researched different preparations that use tofu or other plant based proteins. I learned about textured vegetable protein and different ways to use it. So when January 1st came around, we were armed with knowledge and ready to start. 

As a single dad, I have to keep a close watch on my budget. My grocery budget is pretty tight since I’m feeding 5 people on one income. Because of that, we rarely have a “traditional” American plate with a meat, starch, and veg. Our meals are generally light on animal based proteins anyway but it’s still a significant amount of money every month. But I found my local grocery store regularly has specials on firm and extra firm tofu (like, two 8-Oz packs for $5 usually). I also found a 16 oz bag of TVP for $4.50. Even just using it three nights a week, that was a significant reduction in my weekly grocery bill. 

Well...three nights a week quickly turned into 6 nights. We were having different curry dishes (Penang, red, yellow, green...), 4 bean chili, baked ziti, and so much more. Tons of fresh vegetables, lots of leafy greens, rich sauces...and the smells! Oh my, the house smells so good with all the new spices! And, my two young sons never complained about missing meat and have even asked if we can have some of the tofu and TVP based dishes again. 

So after one month my wallet is heavier, waist is smaller, and nobody feels like they are missing out on anything. My daughter has started cooking more and spending time with me in the kitchen. And all of my kids have seen that I will support them and help them reach their goals however I can. 

I don’t know what the point of this post is but I wanted to share with someone! "
249,You could say I enjoy meat alternatives,montytanana,oihmaa,1468,36,https://i.redd.it/25bi84ktuoa71.jpg,
250,Hand ripped chili oil noodles by my lovely BF + homemade dumplings and a chive pancake by me,sesamebagl,fivivq,1470,34,https://i.redd.it/gvg4jxbwfrm41.jpg,
251,when in doubt cook spaghetti in garlic and olive oil,losplayboys,j0uzrn,1467,61,https://www.reddit.com/gallery/j0uzrn,
252,It's my lucky day. First time I get an avocado with such a small pit. Maybe I should go buy the lottery.,CNW1155,jy0std,1467,24,https://i.redd.it/fywg6mzsjh061.jpg,
253,Why not do politics that benefits you for a change,hiphopvegan,y5mxvz,1456,126,https://i.redd.it/ny2l7n4cg7u91.jpg,
254,Did Thanksgiving like the veg nurse I am; a day late and a turkey short.,sleepyfeeling,k2p229,1462,43,https://imgur.com/ogEvebd,
255,My gf has gone vegetarian for a month and her family didn’t leave her any fries but got more chicken than they could eat,welcometomyparlour,bcnrj6,1458,149,https://i.redd.it/01uclmrb7zr21.jpg,
256,a step in the right direction,a27j27k27,u4ep74,1457,88,https://i.redd.it/dhconiy1mqt81.png,
257,I always forget how much protein Brown Bread has! Time for sammiches!,davidducker,kp2fml,1461,82,https://i.redd.it/zrrqeokcny861.jpg,
258,Thoughts and prayers go out to all my fellow vegetarians at barbecues this summer,sushilovercat,caq88r,1456,97,https://i.redd.it/p2bvqq2005931.jpg,
259,After going veg I really missed a hearty bolognese. This fit the bill. Lentil bolognese.,PDXPTW,agzfik,1451,98,https://i.redd.it/uavas0nfe0b21.jpg,
260,my diet in a nutshell,mrjoffischl,xn7o89,1452,52,https://i.redd.it/vh0id7y48wp91.jpg,
261,The veg option at the work Christmas party. Yay.,Aztexrose,e9cmnh,1453,179,https://i.redd.it/9y9350wad2441.jpg,
262,Vegetarian options in McDonald's in India,duriousmind,qhia4v,1441,145,https://www.reddit.com/gallery/qhia4v,
263,Literally cannot get away from it,Willp130,l0h7pd,1448,131,https://i.redd.it/1qjbmslom9c61.png,
264,"Just because there is no meat on my grill; doesn't mean there is no flavor on my grill. [Recipes, etc. in comments.]",Talking_Head,90wkil,1446,47,https://i.redd.it/8cic7d68tgb11.jpg,
265,"Tofu press? No thanks, I’m all set",hiimgretchen,kxxcwa,1440,101,https://i.redd.it/n5odr3ouqib61.jpg,
266,McDonald's launches vegan nuggets in Norway,honeycombtomb,b3da4t,1434,116,https://www.studentproblems.com/mcdonalds-is-finally-launching-vegan-chicken-nuggets/,
267,It's Time for McDonald's to Offer a Veggie Burger Nationwide,PowermanIronFist,c3abcb,1434,221,https://www.entrepreneur.com/article/335347,
268,"We are drinking way less milk. Americans drank just 149 pounds of milk per capita in 2017, down from 247 pounds in 1975",quellik,ae8evu,1439,182,https://www.npr.org/2019/01/09/683339929/nobody-is-moving-our-cheese-american-surplus-reaches-record-high,
269,I never thought this would happen to me... guys I’ve been blessed!,AsfAtl,k63g3q,1434,62,https://i.redd.it/055w1x14q0361.jpg,
270,Designed an automated kitchen microgreen grower. Thoughts?,Migrova,7ru2bn,1429,70,https://i.redd.it/p6kzk9yl6bb01.png,
271,IKEA's new Plant Balls are a part of their larger mission of becoming Carbon Positive by 2030. The new balls have just 4% of the carbon footprint of the meaty predecessors.,Danny-California-,hvb3mp,1432,77,https://bluedoormedia.co/2020/07/20/ikea-releases-their-new-swedish-plant-balls/,
272,I wanted to eat ratatouille...while watching ratatouille,,hvvc95,1431,29,https://www.reddit.com/gallery/hvvc95,
273,"I’ve cooked meat-free for almost two weeks - longest I’ve ever gone. I always considered myself a meat and potatoes girl, but I’m feeling really proud to have cut it from my cooking while still being able to be creative in the kitchen. This is a Creamy Harissa with Rice.",BushyEyes,fhf63f,1425,43,https://i.redd.it/oil9rcisd8m41.jpg,
274,62 activists blocking the death row tunnel at a slaughterhouse in France,blizeH,878ky3,1427,238,https://i.imgur.com/xSQPv9K.png,
275,What it’s like being veg in rural America,murdermymeat,culwdf,1424,131,https://i.redd.it/4p6y22embai31.jpg,
276,Miley Cyrus releases photos from her meat-free wedding!,textunes,as3k6j,1419,60,https://i.redd.it/ji1q67peveh21.jpg,
277,21st Birthday,AggravatingGate,bee7gb,1416,42,https://i.redd.it/7puj4wnxlws21.jpg,
278,Spicy Tofu Katsu Sandwiches. Out of the this world delicious.,TheBulfinch,ix3hk4,1415,66,https://i.redd.it/ayn0kimzzio51.jpg,
279,hurray for me! i've been officially a vegetarian for a week now!,krista_,8mokr1,1414,111,https://imgur.com/GiixjPP,
280,One of my favorite work lunches. Chickpea and sunflower salad sandwich with avocado and Swiss cheese.,nettletart,dskwv8,1406,69,https://i.redd.it/cpv56f1c64x31.jpg,
281,Brand to avoid if you boycott Nestle.,CatzMeow27,i167d7,1403,112,https://i.redd.it/67bx249126e51.png,
282,Veggie ramen night,sprongwrite,ojqr7p,1399,51,https://i.redd.it/0fr2jsor42b71.jpg,
283,I’m pretty sure I’ve lost count of the amount of times I’ve had to explain that fish counts as meat,LeftistBiBitch,rypy3w,1385,203,https://i.redd.it/t7qfmpnwsda81.jpg,
284,What do vegetarians eat for thanksgiving? Asks everyone. The fixins!,zmrouhas,k1pvfl,1384,96,https://i.redd.it/g5mao1yp5o161.jpg,
285,"This mornings fry up of hash browns, mushrooms, veggie sausages, tomatoes, beans and eggs",Lyska420,i5xt94,1389,58,https://i.redd.it/q8bckak7orf51.jpg,
286,Imagine being this fragile,Turbulent-Smoke,f7w6kd,1379,114,https://i.redd.it/tgclywyamii41.jpg,
287,"""In 30 years or so, I believe we will look back and be shocked at what was the accepted way we killed animals en masse for food."" -Richard Branson",lnfinity,9sd3is,1383,114,https://i.imgur.com/a6wUY8h.png,
288,2 months meat free!!!!!!! Celebrating with some Veggie Chilli.,,avq6in,1370,98,https://i.redd.it/qjp25hjyqaj21.jpg,
289,Vegetarian Only station at my new work building,somewhatinterested,prkvk4,1370,136,https://imgur.com/0VIasea,
290,Celebrating 1 year as a vegetarian with my partner!,Shannonisshannon,ik1lqx,1367,34,https://www.reddit.com/gallery/ik1lqx,
291,Burger Fan Jack Black Says 'It's Time For Everyone To Consider Going Vegan',richbrubaker,e9y6gg,1373,151,https://www.plantbasednews.org/news/jack-black-everyone-should-consider-going-vegan?fbclid=IwAR3q_3c22xjQbzY0Cpy5zoeAAB3GT0RnZUL11FZXVHAghLfgPn3eR3WyNlE,
292,Meat eaters at gatherings be like,thisishardcore_,1133urq,1370,175,https://i.redd.it/vuq0vd6b3eia1.png,
293,*facepalm*,that_squib,lqr11z,1362,20,https://i.redd.it/ofq74rfs5aj61.jpg,
