,Title,Author,ID,Score,Total Comments,Post URL,Post Text
0,me_irl,unidentifiableblarg,5e3zw7,12850,652,http://imgur.com/Zr4k76O,
1,Something we can all agree on,ceruleanbluish,hwnxdx,7636,337,https://i.redd.it/xb1jhezd7oc51.jpg,
2,Every single time I go to a restaurant,,66byzp,5775,422,https://i.redd.it/rjbuazo9wjsy.jpg,
3,"I made this chocolate cake today cause I was sad, but no one I sent it to appreciated it. So please appreciate my cake.",afishandaduck,hlutzf,5600,225,https://i.redd.it/3zpc2iu7z3951.jpg,
4,the revolution has begun,,6yezy8,4087,77,https://i.redd.it/s52hc9efy8kz.jpg,
5,"TIL The Beyond Burger uses 99% less water, 93% less land, has 90% fewer greenhouse gas emissions, and uses half as much energy to make than an equal sized commercial beef burger.",,9n1mtl,4050,285,https://www.plantbasednews.org/post/vegan-beyond-burger-more-sustainable-beef,
6,Equal frites for all,thisguyclicks,bi0zog,3966,104,https://i.redd.it/esaiujce6uu21.jpg,
7,Being vegetarian in middle America,the_infinite,d18j3p,3881,212,https://i.imgur.com/licVgA2.png,
8,Taco Bell added a completely veggie mode for the kiosk.,AkoOsu,fllnl4,3744,149,https://v.redd.it/1s4f7g5d7qn41,
9,"Today we have the braised ligma, with a side of bofa",PM-ME-BAKED-GOODS,jomqy6,3714,95,https://v.redd.it/6b2a6qgdggx51,
10,Hot dogs...made from Carrots! Your angry dad is back throwing things around the kitchen.,Crottison,kqy7r6,3580,229,https://v.redd.it/9ekea8npji961,
11,Happy Thanksgiving everyone,bdmast85,e0pons,3565,43,https://i.redd.it/6piy5vnrni041.jpg,
12,Painfully true. But getting better all the time,davidducker,plj064,3421,239,https://i.redd.it/jnc3xhm7tnm71.jpg,
13,"""Tofu is gross""",geografeline,k13bcr,3409,134,https://i.imgur.com/ZYOSwhl.jpg,
14,All meant in good humour! But it is one of the many reasons I love this subreddit and rarely visit r/vegan.,WithinElysium,j89u3o,3385,194,https://i.redd.it/wg393yqml5s51.png,
15,Improvise. Adapt. Overeat.,PM-ME-BAKED-GOODS,jr0nxx,3143,81,https://i.redd.it/7idw9te7q8y51.jpg,
16,I love almonds but I don't love almond butter.,,av3p0t,3116,155,https://i.redd.it/x5eup253wyi21.jpg,
17,Ordered dinner from The Dog House in London. Not only is their food amazing but they split the bacon loaded fries my SO ordered into 2 boxes and kept a serving with no bacon as they saw a vegetarian hot dog in the order. Such a sweet gesture!,ilovepuscifer,i8kkl8,3111,71,https://i.redd.it/32dyoelzjmg51.jpg,
18,My favourite part of christmas,blimey_guvnor,aq9g31,3095,33,https://i.redd.it/8umxl1pgldg21.jpg,
19,Me listening to my coworkers’ collective anxiety about having to be vegetarian due to a possible meat shortage,kissofdeathXX,gad5ao,3024,165,https://i.redd.it/a7jb7cx4gsv41.jpg,
20,Couldn’t be prouder of my local grocery store.,Bosco00,byfk2g,3008,40,https://i.redd.it/ywa0jhb2r8331.jpg,
21,North Indian food is love,,iaupbi,2982,68,https://i.redd.it/0ba1xt5izdh51.jpg,
22,#Healthylifestyle ?,hannahb3th,alkfij,2985,114,https://i.redd.it/taivvxlr0od21.jpg,
23,I hope you will enjoy my meme,potzak,dymcc6,2931,260,https://i.redd.it/wttkj5su1oz31.jpg,
24,I used a can of tomatoes as a tripod to hold my camera whilst filming this. Chucked together some veggie pies today.,Crottison,kobr0m,2928,122,https://v.redd.it/ek59bck49q861,
25,"Yogurt, peach and apple",fractallane,fu56uw,2922,77,https://i.redd.it/81m3x7eylkq41.jpg,
26,POV: you're a vegetarian at a fancy restaurant,Strawberry_Curious,11sfjsh,2922,272,https://i.imgur.com/9x7HLye.jpg,
27,i love ellen,pugsnroses77,9zht0b,2916,40,https://i.redd.it/h2u9sqmi2yz11.png,
28,Grandma's mad tricks to get the kiddles to eat healthy.,darylsheajones,6s4h26,2905,108,https://i.redd.it/1fcd6wmhbaez.jpg,
29,Pretty impressed with the selection at my local supermarket these days,Otisspam,d7ok3l,2874,146,https://i.redd.it/7th90j1me4o31.jpg,
30,A thought about vegetarianism,otfitt,s2l4ns,2858,363,https://i.redd.it/43xaqbs9kcb81.jpg,
31,Dutch ministry makes 'vegetarian' the standard option at official dinners. If you want a meat dish you have to specify beforehand,sophiajoplin,9z46j0,2817,53,https://www.kinder-world.org/articles/solutions/dutch-ministry-makes-vegetarian-the-standard-option-at-official-dinners-19837,
32,Eating out,leptonomo,fddr95,2740,104,https://i.redd.it/pr3deizl1ok41.jpg,
33,It’s easy being a vegetarian when you have harvests like these. Nothing tastes better than home grown veg.,beeeeeeee123,ihede4,2686,80,https://i.redd.it/qf0a7kpz0hj51.jpg,
34,For a friend,r_y_r_y,edvi82,2678,122,https://i.redd.it/o27ktxsez1641.jpg,
35,Felt this belonged here,Baconflavors,iwq8ma,2629,40,https://i.redd.it/esxupy7weeo51.jpg,
36,And celery...,Big_Fillup,ivi6gl,2627,114,https://i.redd.it/6ldc16wt10o51.jpg,
37,Taco Bell To Trial Dedicated Menu for Vegetarians and Vegans,bulbysoar,aevdf7,2604,140,https://www.livekindly.co/taco-bell-trial-vegan-vegetarian-menus-select-locations/,
38,This Focaccia Isn’t Your Garden-Variety Flatbread,JaynesVoice,g92vi3,2602,30,https://i.redd.it/1nzrqjw5qdv41.jpg,
39,Looking at veg recipes be like,Hotter-Otter70,11983em,2592,166,https://i.redd.it/b8vp9badxtja1.jpg,
40,At least fake meat is still getting attention,cooltop101,euhbl3,2586,199,https://i.redd.it/8ev37ws5f8d41.jpg,
41,"Chickpea patties! Make them like this, or in a burger, you decide I'm not your dad....or am I?",Crottison,kpjnzc,2561,149,https://v.redd.it/6e4z6n6004961,
42,"""You're vegetarian? You must be so healthy!""",hurricaneswain,iqhknv,2541,115,https://i.redd.it/ti07bar9ffm51.jpg,
43,"My office cafeteria does things well: BBQ tofu, wild rice with veggies, roasted broccolini, quinoa with butternut squash, fall apple-cranberry salad with feta and walnuts.",tjraph,yk6hby,2522,90,https://i.redd.it/ln2ryy20rjx91.jpg,
44,Pizza Hut Partners With Beyond Meat To Become First National Pizza Company To Offer A Plant-Based Meat Pizza Coast to Coast,c8h8r8i8s8,jrn4k9,2520,155,http://blog.pizzahut.com/pizza-hut-partners-with-beyond-meat-to-become-first-national-pizza-company-to-offer-a-plant-based-meat-pizza-coast-to-coast/,
45,"I have enjoyed that despite the panic buying here in Melbourne, people are still refusing to buy anything vegan/vego",Bear_Powers,fibn1o,2488,135,https://i.redd.it/1kxaqdvyvjm41.jpg,
46,I’m lazy,tired0123456789,kagsjo,2477,90,https://i.redd.it/fn5cr2z2kd461.jpg,
47,Here’s my fancy self-draining tofu press,CAPSLOCK44,lpczyt,2437,77,https://i.imgur.com/HkRspxu.jpg,
48,"""Eww fake chicken!"" [Humour]",kristahatesyou,5zf6gz,2434,476,https://i.redd.it/ub2iii2u1gly.jpg,
49,"Nine years ago today I posted this on Facebook. Needless to say, it lasted",hiimgretchen,ikjcs4,2397,67,https://i.redd.it/y6qy5k5k5jk51.jpg,
50,"McDonald’s Adds Vegan Burger to Menu in Chicago — The chain’s headquarters restaurant is now featuring the vegan McAloo Tikki burger, imported from its Indian menu. The vegan burger patty is made with potatoes, peas, and comes topped with red onions, tomato slices, and an eggless tomato mayo",BlankVerse,a7p4jw,2373,157,https://vegnews.com/2018/12/mcdonalds-adds-vegan-burger-to-menu-in-chicago,
51,Burger King plans to release plant-based Impossible Whopper nationwide by end of year,digital_angel_316,bip3hg,2369,171,https://www.usatoday.com/story/money/food/2019/04/29/burger-king-impossible-whopper-vegan-burger-released-nationwide/3591837002/,
52,"""You're a vegetarian? You must eat so healthy!""",busty_chemist,c0y0kk,2348,175,https://i.redd.it/0rku3snp8j431.jpg,
53,Times are changing,blizeH,8q4bwc,2332,162,https://i.imgur.com/x0P8t1f.jpg,
54,When the gang is choosing a place to eat :(,LePillow,hsp3vo,2329,83,https://i.redd.it/v9bku99jfcb51.jpg,
55,me_irl,WhyArrest,83z24v,2322,86,https://i.redd.it/zzv46zwcpel01.png,
56,Relatable,VampyreLust,aba3hr,2315,43,https://i.redd.it/pm8p4autzl721.jpg,
57,Almost 90 percent of the people eating non-meat burgers are not vegetarian or vegan,BlankVerse,dy6g4e,2317,156,https://www.nbcnews.com/business/consumer/almost-90-percent-people-eating-non-meat-burgers-are-not-n1082146,
58,me_irl,,jv6y9c,2285,105,https://i.redd.it/2yjk422yvlz51.jpg,
59,Went from vegan to vegetarian after 10 years today. Why? Because my gorgeous hen just laid her very first egg. And it was the best egg I ever had!,mewithoutjew,kj28rk,2265,51,https://v.redd.it/w5luhm2ld0761,
60,Paul McCartney everyone...,promixr,eh6y9s,2246,177,https://i.redd.it/p9198swe9l741.jpg,
61,Beyond Meat founder: Our plant-based meat is on its way to being cheaper than animal protein,fdjadjgowjoejow,hi1qep,2239,193,https://www.reddit.com/r/vegetarian/comments/hi1qep/beyond_meat_founder_our_plantbased_meat_is_on_its/,"[https://finance.yahoo.com/news/beyond-meat-founder-plantbased-meat-is-on-its-way-to-being-cheaper-than-animal-protein-140141254.html](https://finance.yahoo.com/news/beyond-meat-founder-plantbased-meat-is-on-its-way-to-being-cheaper-than-animal-protein-140141254.html)

Sozzi: You actually think you can make your meat cheaper than traditional meat?

Brown: Absolutely.

(How about a low sodium version?)"
62,Some Vegetarian Foods I Ate in Paris,FearlessTravels,wf2y6k,2239,117,https://www.reddit.com/gallery/wf2y6k,
63,I got really excited too...,stalechips,izbpl1,2240,88,https://i.imgur.com/SghoAjd.jpg,
64,"No more “no meat, sub with beans”!!! Del Taco widely releasing Beyond Meat tacos in 10 days",,bdik12,2210,128,https://i.redd.it/k909eboumgs21.jpg,
65,"Not to offend anyone, I just feel this way",vzb227,own5cu,2209,245,https://i.redd.it/3sdyj6kp80f71.jpg,
66,When work has Christmas lunch catered but the vegetarian option is seafood,imdamoos,kl449s,2200,201,https://i.imgur.com/EwzYnrn.jpg,
67,It honestly feels like they add it to foods just to mess with us,PM-ME-BAKED-GOODS,jplt9g,2200,164,https://v.redd.it/w2th2luperx51,
68,Honey Soy Cauliflower...aggressively,Crottison,ksau3g,2197,110,https://v.redd.it/l1up4sct2w961,
69,Veggie sandwich,juliaodoylie,h92sij,2197,103,https://i.redd.it/fzc9f4zz7y451.jpg,
70,BEYOND MEAT WILL MAKE VEGAN PROTEIN CHEAPER THAN ANIMALS,HermannVHelmholtz,bibztr,2174,128,https://www.livekindly.co/beyond-meat-will-make-vegan-protein-cheaper-than-animals/,
71,"Today my wife and I are starting a no-meat week. Both coming from large, meat-and-potatoes-and-boxed-meals families, we've decided to make a change. Our goal is to be 100% meat free by the new year!",MacyWindu,d8ddk1,2169,122,https://i.redd.it/l6z53c83yeo31.jpg,
72,“You’d have to eat before going out with friends because who knows if they had more than fries or a salad for you to choose from”,JulioCesarSalad,o0ej4v,2136,184,https://i.imgur.com/IzKk6aZ.jpg,
73,"I have been a vegetarian for ~15 years, and I have to say that there has never been a better time than now",,j5juar,2119,277,https://i.redd.it/eu8kdmf28ar51.jpg,
74,For Economic Vegetarians,mightymite88,ldpzwm,2102,342,https://www.reddit.com/gallery/ldpzwm,
75,Got inspired by that hummuswich from a few days ago,1n51d3L1ght,ipjczg,2067,56,https://i.imgur.com/Gwibdcd.jpg,
76,I’m a 4 day (so far) vegetarian and Grubhub driver; I had a huge KFC order cancelled on my way to the house...,levyhime,9tmtia,2061,138,https://www.reddit.com/r/vegetarian/comments/9tmtia/im_a_4_day_so_far_vegetarian_and_grubhub_driver_i/,"I’m a Grubhub driver and had a huge KFC order (big bucket of chicken and sides) cancelled on my way to the house. When this happens, we are told to “dispose” of the food. Which, if the delivery driver is hungry, they could just eat the food. Being vegetarian only four days, my temptation to eat the free chicken was high. I ended up giving the chicken to someone homeless and resisted the temptation to eat it. I’m very proud of myself for this!!! 4 days into forever! "
77,My lovely mom made this decadent veggie omelette for me because she “almost forgot to make a veggie option and just threw something together.” I’ll take this over chicken any day.,SaraReneeCat,lvuiwx,2060,70,https://www.reddit.com/gallery/lvuiwx,
78,"How Beyond Meat became a $550 million brand, winning over meat-eaters with a vegan burger that ‘bleeds’ - Producing Beyond Burgers uses 99 percent less water, 93 percent less land, creates 90 percent fewer greenhouse gas emissions and requires 46 percent less energy than producing beef burgers",ElectronGuru,aif6y8,2060,140,https://www.cnbc.com/2019/01/21/how-bill-gates-backed-vegan-beyond-meat-is-winning-over-meat-eaters.html,
79,Post Malone invests $2.3 million in vegan burger company,Debug_Your_Brain,p6cb76,2057,57,https://www.freedomwires.co/2021/08/post-malone-invests-23-million-in-vegan.html?m=1&fbclid=IwAR3pR5rQihEeaNhb1sYqgD2a4DsGDw3rKM6Gma2RczPqXawjP15a_E8mKIY,
80,Just a few ways we can help the Amazon Rainforest,alearcmil,cvo1i7,2040,143,https://i.redd.it/s3ypopx9msi31.jpg,
81,Our army base never had good food for vegans. Today I (a cook) am starting to change that with tofu schnitzel,theendlesslights,nhqskm,2015,80,https://i.redd.it/vy31uvo9rg071.jpg,
82,"Millennials Are Driving The Worldwide Shift Away From Meat - Thanks to shifting tastes amongst those born after 1980, 70% of the world’s population is reducing meat consumption or leaving meat off the table altogether",ElectronGuru,a5v5s5,2014,72,https://www.forbes.com/sites/michaelpellmanrowland/2018/03/23/millennials-move-away-from-meat/,
83,"Had to share my favorite sandwich! Hummus, muenster cheese, avocado, red bell pepper, red onion, cucumbers, salt and pepper. I can eat this every day!",emmymacc,iocg6e,2007,67,https://i.redd.it/2wmmb8xtlrl51.jpg,
84,"I know if I'm going to stick with something I need to make a cute motivational system. Tried to make each ""prize"" something that benefits my health. Any ideas for the big one at the end?",emmeline29,djua4g,2009,212,https://i.redd.it/a9ksf1wicdt31.jpg,
85,"Burger King to offer vegan patty, saving 300 million egg whites annually",register2014,b16k59,1997,118,https://www.livekindly.co/burger-king-largest-fast-food-chain-vegan-burgers/,
86,i’m just trying to plan my meals okay,disordered_anarchist,e768iw,1991,113,https://i.redd.it/c8ouk7oii3341.png,
87,Arnold Schwarzenegger: I've Given Up Meat For The Benefit Of Humanity,Hardrainfallings,7nh4nq,1994,51,http://bloomsmag.ga/w6t5,
88,A Vegetarian in 1911,caseytimes,m3jfji,1986,74,https://i.imgur.com/yN6xN9L.jpg,
89,I recently started a food page which visually represents what 100 calories looks like for a range of different foods. Here are some of the veggie friendly posts. If you’re interested in seeing more just let me know!,100caloriesclub,hsdlnc,1985,113,https://i.redd.it/pawfgtfk49b51.jpg,
90,Shoutout to everyone who went vegetarian despite liking meat,khelfen1,cd269k,1977,195,https://i.redd.it/9g98gspnc9a31.jpg,
91,"First month eating more vegetarian and healthy. Ended up at 50%, goal next month is for us to eat 80%. May not seem like much but it's a big change for us. Bonus, the log is fun to keep.",renwoman1127,l9rojz,1970,103,https://i.redd.it/7dhrqfpotre61.jpg,
92,"My Dad isn't someone who really understands being a vegetarian - always asking if I want a bacon cob and what not. Yesterday he made an effort to try and bring me something I might eat for dinner at home and gave me a whole cabbage, out of nowhere. Thanks Dad, gotta love him.",nthnells,cth6ly,1963,99,https://i.imgur.com/suNEnQi.jpg,
93,The Impossible Whopper is coming to every Burger King in America next week,EdgerAllenPoeDameron,cko8w8,1965,297,https://www.cnn.com/2019/08/01/business/impossible-whopper-national/index.html,
94,Snoop Dogg Served Vegan/Vegetarian Burgers at his Grammy's Party!,textunes,aqrxxw,1958,52,https://i.redd.it/yiatarwrang21.jpg,
95,Happy Valentines day!,ginmartini2olives,ljqi96,1963,12,https://i.redd.it/p4tjtkgupgh61.jpg,
96,At Whole Foods!,desstiaj03,iemcog,1955,137,https://i.redd.it/09ccmofi7li51.jpg,
97,"Last week, New York City announced that all of its public schools would be implementing Meatless Mondays. In response the North American Meat Institute wrote a letter to the mayors office in protest. Borough President Eric Adams just published this response to the NAMI letter.",lnfinity,b2wokb,1948,140,https://imgur.com/a/ERigFXe,
98,Beyond Meatball Marinara sub will launch in 685 Subway restaurants across the U.S. and Canada starting in September.,noo00ch,cn6vcj,1946,149,https://i.redd.it/gqwk22nxj1f31.jpg,
99,First vegetarian thanksgiving!,smizelize,k1mh2i,1931,54,https://i.redd.it/33xoeccr6n161.jpg,
100,Feeling the familial love for this 8 mo vegetarian,LittleBallOFur,e3zkwl,1927,63,https://i.redd.it/4rrcvnt1vu141.jpg,
101,Who else enjoys making Indian food?,SpicedCurry,8p3ibz,1925,131,https://i.redd.it/p74alzp3lf211.jpg,
102,Millennials Are Driving The Worldwide Shift Away From Meat - A full 70% of the world population reportedly is either reducing meat consumption or leaving meat off the table altogether,skulloflugosi,8aj9z4,1919,104,https://www.forbes.com/sites/michaelpellmanrowland/2018/03/23/millennials-move-away-from-meat/,
103,Great sources of protein,Sy3Zy3Gy3,lxoywf,1909,117,https://i.redd.it/vog01q97i1l61.jpg,
104,"Taco Bell is testing a new plant-based vegan 'Cravetarian' protein as it doubles down on vegetarian options — Taco Bell is testing a vegetarian protein made from chickpeas and peas. [Tustin, CA only]",BlankVerse,mvngdo,1913,169,https://www.businessinsider.com/taco-bell-vegan-plant-based-protein-chickpeas-beyond-meat-cravetarian-2021-4,
105,imagine being mad about plant based options smh,naturallyhanna,wfqr9m,1909,129,https://i.redd.it/6v8aei5wamf91.png,
106,Chart of plant-based protein sources,FruityandtheBeast,gde4z9,1897,97,https://i.redd.it/tjvy6ofwsrw41.jpg,
107,MIL appreciation post!,littlebauer,qzstqo,1892,110,https://i.redd.it/yb8kwx6l27181.jpg,
108,"A friend told me vegetarian does not equal healthy, I agree.",wack70,q9nrr7,1877,112,https://i.redd.it/5dxhis08kwt71.jpg,
109,"I am a vegetarian and my Japanese boyfriend's parent cooked this vegetarian feast for me, ( exclude the sashimi)",sandyyap2612,9ubvaq,1873,56,https://i.redd.it/pvntku8z3hw11.jpg,
110,Got 40 patties from my mom,DemiLavotosForehead,g8hti1,1872,96,https://i.redd.it/hbj11q6h07v41.jpg,
111,Potato appreciation post. Because potatoes are the best!,chefboofardee,11yuj5k,1871,77,https://i.redd.it/lees1y0xzdpa1.jpg,
112,Veggie burritos are underrated.,Marchalize,fr8g0y,1866,66,https://i.redd.it/wkgjrgvq0np41.jpg,
113,"My coworker went out of her way to cook me a vegetarian Thanksgiving meal. It was packed with roasted brussel sprouts, scalloped potatoes, stuffing, etc.",,e4h0o2,1864,29,https://i.redd.it/op6uec7mp0241.jpg,
114,Having a chicken for dinner,misstresschief,7xi71w,1859,55,https://i.redd.it/xe4joaanq6g01.jpg,
115,"United Nations finally states what we have all known all along: ""Plant-based diet can fight climate change""",1Davide,cnl705,1853,72,https://www.bbc.com/news/science-environment-49238749,
116,Panda Express launched the Orange Beyond Chicken in the US today at all locations. Highly recommended!,LuckyColtsFan69,x8blrf,1852,200,https://i.redd.it/c6s9ht1ymim91.jpg,
117,"If you ever visit Sweden, try the local hamburger chain Max - this is their vegetarian selection (all of them are amazing)",,a6y0qg,1846,188,https://i.redd.it/8akr9o1sts421.jpg,
118,Beyond Meat to sell cheaper value packs of its meatless burgers,sailorglitter91,hatvtd,1852,126,https://www.cnbc.com/amp/2020/06/17/beyond-meat-to-sell-cheaper-value-packs-of-its-meatless-burgers.html,
119,My two scenarios,Nova_Physika,g9rhv6,1837,126,https://i.redd.it/h61p9ufuflv41.png,
120,"Plant-based meat about to get cheaper than animal flesh, report says",michkennedy,ca85k3,1822,78,https://vegnews.com/2019/7/plant-based-meat-is-about-to-get-cheaper-than-animal-flesh-report-says,
121,"I posted this chart in 2019, but I stopped using it halfway through because going veg was easier than I thought! Today is my TWO year anniversary and I plan to be vegan in 2022. :)",emmeline29,q821el,1816,150,https://i.redd.it/qetg3vabpft71.jpg,
122,Avocado toast I just made,1n51d3L1ght,fpd46e,1813,54,https://i.imgur.com/I082J9J.jpg,
123,Fantastic Ethiopian Vegetarian Platter,DocPseudopolis,b20i0l,1811,72,https://i.imgur.com/1MgiLte.jpg,
124,Never seen vegetarian sausage at a hotel breakfast before - Shout out to Residence Inn!,adequatulous,a9omw8,1810,46,https://i.redd.it/l9cwrh5klm621.jpg,
125,When has this man ever been wrong?,JimmieRusslah,a3nlxz,1805,88,https://i.redd.it/tpn0n9bpmn221.jpg,
126,"TIL Jon Stewart is a vegetarian, his wife is a vegan, and they have a 12-acre farm for abused animals",peacebypiecebuypeas,5nje5m,1796,97,https://en.wikipedia.org/wiki/Jon_Stewart#Personal_life,
127,A reason to not eat beef for another 12 years.,kingdomphylumm,9j7q16,1790,139,https://i.imgur.com/a9hklgX.gif,
128,"Don't see much talk about cookbooks in here so I thought I would throw out some from my favorite veg-chef. Bryant Terry is an incredible talent that exudes passion for, not only vegan/veggie cooking, but cultural promotion. Plus, he offers sound track recommendations with his recipes.",,he4gv5,1782,63,https://i.redd.it/1nm8z00p2k651.jpg,
129,Great signage outside a new veg restaurant in Calgary,beesmakenoise,fg0fep,1776,47,https://i.redd.it/xn32ukzt9pl41.jpg,
130,She's not wrong,Dogsanddogs,pg6wjk,1772,135,https://i.redd.it/syfpeqh5kzk71.jpg,
131,"Going vegetarian in 2020 and this sandwich will be my new go-to for a (not-so-sad) desk lunch - taziki dip, cucumber, spinach, tomato and avocado on a toasted everything bagel",lauren825,ec0kat,1767,102,https://i.redd.it/e55arx52w8541.jpg,
132,I made a vegetarian starter pack lol,Uhhlaneuh,x3lnlk,1767,247,https://i.redd.it/hikravt4ybl91.jpg,
133,Carl's JR to be first ever vegan meat ad and will air during Super Bowl,textunes,amkwft,1765,101,https://i.redd.it/1eyemkcpb9e21.jpg,
134,"Another sandwich post. Mushroom, onion and gouda melt.",rjlupin86,itvc1t,1760,46,https://i.redd.it/2ewx36c9gin51.jpg,
135,Truth.,skulloflugosi,85ed4p,1755,378,https://scontent.fyvr4-1.fna.fbcdn.net/v/t1.0-9/29178362_10212776988072433_4450238360979505152_n.jpg?_nc_cat=0&oh=79c37c82283161eefc06c46b741926f6&oe=5B3A7D9A,
136,When a vegetarian hosts a Christmas Eve dinner.,TheWeeMouse,efjfcz,1749,32,https://i.redd.it/dyihfk66it641.jpg,
137,Jaden Smith to Open a Vegan Restaurant Where Houseless People Can Eat for Free,FrameLife_,njw8li,1754,109,https://www.speciesunite.com/news-stories/jaden-smith-to-open-a-vegan-restaurant-where-houseless-people-can-eat-for-free,
138,a recipe we can all get behind,adobeallen,t9543q,1744,35,https://i.redd.it/agmw4lu5b2m81.jpg,
139,Now at Costco:,ElectronGuru,dvdeg5,1737,136,https://i.redd.it/qhethrhqlay31.jpg,
140,All New York City public hospitals now serving vegan meatless Monday meals!,textunes,agpb01,1740,26,https://i.redd.it/40uuekj4gua21.jpg,
141,Spicy Black Pepper Tofu,Cheerful-as-fuck,9piuv1,1738,73,https://i.redd.it/vpewmgetl4t11.jpg,
142,A standard day from my home garden. I can’t wait to have more land so I can farm all my own food.,ScoobyDoobieBlue,i0blil,1726,50,https://i.redd.it/e6fox7aewvd51.jpg,
143,"I’m visiting Austin, TX and LIVING for this vegan Vietnamese food truck!",nettletart,dcyi8y,1729,87,https://i.redd.it/2f2lxf63meq31.jpg,
144,Boyfriend is at a wedding. This made me smile,jellyjellybeans,dqtre5,1726,78,https://i.redd.it/zdpnfmvcidw31.png,
145,I tried Beyond Meat sausage at Hardee's - They scraped the grills.,telecomteardown,ejfisn,1727,133,https://www.reddit.com/r/vegetarian/comments/ejfisn/i_tried_beyond_meat_sausage_at_hardees_they/,"I know this is anecdotal and will only concern certain peoples but as I was waiting for my meal (I ordered a Frisco Breakfast Sandwich with Beyond Sausage instead of ham) I overheard the kitchen manager instructing her staff on the preparation of the sausage. One of the things that stood out was she was telling a story of a friend of hers that had the Impossible Burger at Burger King the other day and became sick. She said the reason was that her friend was allergic to meat and the Impossible Burger had flecks of meat from the grill on the sandwich which in turn made her sick when she unknowingly ate them. She then told her staff, ""...and this is why they said to make sure to thoroughly scrape the grill clean before you cook the Beyond Sausage, and use the designated spatula.""

The kitchen didn't know I could hear them from the counter but I asked the cashier when she brought me my food to please let the manager know that I overheard what she said and I thank her for being so considerate. 

That kind of conscientious attitude will go far with vegetarians in my opinion. Oh, and the sandwich was pretty good too."
146,Vegetarian Protein Chart,HermannVHelmholtz,bouy5v,1718,169,https://i.redd.it/1w6fgs58xby21.jpg,
147,Attending an all day meeting at work,KyleDComic,10p78u2,1721,169,https://i.redd.it/hdowj6j729fa1.jpg,
148,"""wow you're a vegetarian you must eat so healthy"" yes, sure, I am the epitome of health, thank u",PurplePoogle,bvb6f0,1715,142,https://i.redd.it/bcirmzj3cl131.jpg,
149,McDonald’s in France just released a new veggie burger. I approve,ghstct,768n5s,1710,200,https://i.redd.it/lsx5ncmsnorz.jpg,
150,Actual video of me during self isolation.,shelbsless,flvb7x,1710,11,https://v.redd.it/ivggyybsdsn41,
151,(X-post from r/mildlyinteresting) difference between pepperoni and veggie pizza.,,8vdtrh,1711,161,https://i.redd.it/xb16q58e2f711.jpg,
152,Burger King is introducing 'Impossible Whopper'. (Not April Fools),drastick,b83oon,1711,216,https://www.nytimes.com/2019/04/01/technology/burger-king-impossible-whopper.html,
